termo,query,subreddit,id,created_utc,ano,score,body,permalink
apply,aplicar,brdev,hmqeqkq,1638318622,2021,3,"Se começou pelo java e gosta do java, continua no java. O problema da maioria dos iniciantes é querer ser o famoso Jr fullstack, quer fazer de tudo mas não faz nada direito.   
Foca no teu java e ignora todo o resto.

  
Agora sobre coisas não técnicas: 

\- Seja comunicativo, é muito bom ter devs que sabem conversar no time e não são aqueles caras 110% técnicos que não sabem se expressar quando precisam explicar uma solução ou pedir ajuda pra um problema.  
\- Não seja humilde qnd falar de você. Não minta, mas seja confiante e não tenha medo de aplicar pra vagas quando não cumprir 100% dos requisitos.  
\- Seja autodidata, não aqueles caras que não conseguem aprender nada se não tiver um professor na frente, vc vai ter q resolver problemas 100% do seu tempo como dev e a maioria deles ninguém vai te pegar pela mão.  
\- Saiba inglês.",/r/brdev/comments/r5z5dx/qual_é_o_perfil_de_uma_pessoa_pela_qual_as/hmqeqkq/
apply,aplicar,brdev,hmszeki,1638372281,2021,1,"é meio aleatório, vc pode ser taxado no declarado ou podem abrir e vão te aplicar uma multa de 100% o valor do produto + 60% da taxa, depende do bom humor do cara que ta na alfandega no dia",/r/brdev/comments/r6cpxv/taxa_de_importação_pra_um_presente/hmszeki/
apply,aplicar,brdev,hmu3q3q,1638388138,2021,1,"Entendi, obrigado,to querendo iniciar na area ai quando vejo algumas coisas assim fico com um certo receio de aplicar a vaga e acabar sujando o currículo.",/r/brdev/comments/r6lwvj/como_funciona/hmu3q3q/
apply,aplicar,brdev,hmuv9lp,1638398667,2021,9,"Me parece ser uma atividade para aplicar conceitos de orientação a objetos, como:
- classe (abstrata, concreta)
- atributo
- método (concreto, abstrato, construtor)
- encapsulamento, herança, polimorfismo, etc

Se você souber estes conceitos a implementação fica simples em qualquer linguagem (só muda a sintaxe). De uma lida sobre os conceitos e pesquise como implementá-los em Java.

Veja a parte de Vocabulário essencial do wiki sobre OO: https://pt.wikipedia.org/wiki/Orienta%C3%A7%C3%A3o_a_objetos",/r/brdev/comments/r6qlud/alguem_consegue_me_ajudar_a_montar_a_lógica_disso/hmuv9lp/
apply,aplicar,brdev,hn3a48x,1638552641,2021,3,"Tanto faz se fez faculdade nos EUA ou no Brasil, tu pode aplicar pra essas vagas de emprego de 100k de qualquer maneira. Nada impede.",/r/brdev/comments/r7y8jc/faculdade_de_ciência_da_computação_nos_eua_tem_o/hn3a48x/
apply,aplicar,brdev,hn9saqs,1638669657,2021,1,"Cara, acho q a pessoa tem q gostar... vejo muita gente entrando na área pq paga bem. Mas é aquilo, se n gostar, n vinga. Geralmente as pessoas começam com html e css (que é bem fácil, por sinal), mas quando chega no javascript e framework, desistem ou não conseguem evoluir pq só ficam vendo projetos.

Se ficar só copiando projeto a pessoa não sai do lugar, tem que entender o conceito e saber quando e onde aplicar",/r/brdev/comments/r91f4i/se_você_pode_aprender_a_programar_de_graça_no/hn9saqs/
apply,aplicar,brdev,hnadw7h,1638679999,2021,2,"Eu não migrei, procurei meu primeiro emprego já como dev, devo ter aplicado pra mais de 100 empresas antes de conseguir minha chance. 

Mas tem gente que aplica pra primeira e já consegue. Gente que aplica pra 1000 e não consegue. Tempo também é relativo, vai ter gente te falando de 2 meses até 2 anos. Realmente é complicado estimar, mas não é preocupação.

O truque é conseguir se vender, e fazer sua própria sorte.

# Se vender:

- Currículo bem feito, mostrando projetos que tu fez de programação, mostrando que sabe o que faz e gosta do que faz.

- LinkedIn atualizado com todos teus projetos e o máximo de detalhes possível. Tenta criar conexões e postar de vez em quando um projeto novo.

- GitHub... Tem que saber Git e ter um GitHub com teus projetos.

# Fazer sua sorte:

- isso é algo que alguma outra pessoa falou em uma palestra, não lembro quem. Mas basicamente se você tem 1% de chance de ser aceito, tem que tentar 100 vezes. Se tu quer jogar um dado e ganhar 6, não adianta jogar uma vez só. Tem que continuar jogando até ganhar esse 6.

- Tua chance de contrato pra primeiro emprego dev é muito baixa, mas tem uma vaga lá esperando. Tu só precisa aplicar pra centenas até achar ela. Claro, isso assumindo que teu currículo, LinkedIn e GitHub tão atraentes, não adianta aplicar pra 4000 vagas se não consegue nem mostrar que sabe programar.",/r/brdev/comments/r8s900/quem_migrou_de_uma_área_da_ti_pra_dev_quanto/hnadw7h/
apply,aplicar,brdev,hnl0uy8,1638878240,2021,15,"eu fiz pra entrar no Facebook em 2020, vulgo meta, a parte ruim é que eu teria que me mudar pra são paulo capital e por alguns motivos relacionados a covid se tornou impossivel no momento, olha, apesar de ter sido dificil foi de longe minha melhor experiencia em processo seletivo, extremamentes rápidos, varios materiais pra estudar e sempre tem alguém pra te orientar e só pra quebrar o mito de faculdade foda, eu estudei numa particular aqui do interior de são paulo e basicamente são 2 provas de quadro branco, 1 com engenheiro la de nova york e dps do escritorio do BR, dps vc troca uma ideia com a glr la pra ver se vc não é doido né (entrevista comportamental), dps é o gestor, dps é a oferta, caso vc não aceite ou não passe em alguma etapa realmente tua ficha fica cadastrada la numa plataforma q tu ganha acesso, dai da pra tu ver as vagas e apenas aplicar rapidamente.

sem duvida irei tentar com outras MAMAA, mas em resumo achei mt boa a xp, não sei das outras né",/r/brdev/comments/rase4j/o_quão_difícil_é_conseguir_trabalhar_em_uma_das/hnl0uy8/
apply,aplicar,brdev,hno2ihs,1638928854,2021,0,Pra que fazer uma graduação ja sabendo que não vai aplicar o conhecimento ?,/r/brdev/comments/rbe1dd/dúvidas_sobre_vagas/hno2ihs/
apply,aplicar,brdev,hopbbqq,1639606836,2021,4,"Cara acho isso aí tem até uma certa razão, mas para uma empresa que certeza de várias pessoas só trabalhando no setor de Rh que é para procurar pessoas para isso acho que não faz sentido. 
Pra que merda eu vou ter um setor especializado para achar bons candidatos se vai aplicar essa lógica que você disse? Isso funciona mais em empresas de pequeno ou médio porte. 

O setor do Rh é zoado demais … sem falar outras coisas, bastar abrir o LinkedIn e ver o que eles postam lá. 

Enfim é só minha opinião …",/r/brdev/comments/rh7zju/mancada_da_magalu/hopbbqq/
apply,aplicar,brdev,hoq6bj3,1639620487,2021,1,"lamentável, mas meio que é assim mesmo. vejo em subs e comunidades gringas o pessoal falando que precisa aplicar pra mais de 100 vagas até conseguir um emprego, depois de se formar em computação.

tem milhares de pessoas disputando as mesmas vagas, precisa ter paciência.",/r/brdev/comments/rh7zju/mancada_da_magalu/hoq6bj3/
apply,aplicar,brdev,hpdd42y,1640051314,2021,2,"Eu comecei a aplicar para trabalhos remotos semana passada na esperança de até 2023 eu ache alguma merda.

Eu to usando principalmente o weworkremotly, linkedin e stack overflowjobs.

Eu ainda n descobri como usar o linkedin direito para filtrar vagas remotas que aceitam gente fora de US/EU, o filtro do linkedin é meio genérico d+.

weworkremotly é o melhor nese sentido, porém, a maioria das vagas é para senior. Mas tem umas vagas para pleno.

Eu to aplicando somente para vagas que tem uma candidatura relativamente simples, se pedir pra preencher formulário com infos q já estavam no meu cv eu já nem faço.",/r/brdev/comments/rl2ckf/trabalho_no_exterior/hpdd42y/
apply,aplicar,brdev,hpffmnb,1640097547,2021,2,"Estágio dá sim, comece a aplicar pras vagas e peça feedback sempre que possível",/r/brdev/comments/rlfqx2/conseguir_estágio_com_apenas_o_básico_de_html_css/hpffmnb/
apply,aplicar,brdev,hphid9w,1640128027,2021,2,"Cara. Depende.

Depende de que linguagem você vai estudar e principalmente qual tipo de vaga você vai aplicar.

Acho que você precisa primeiro decidir melhor o que você vai focar, saca?

Acho que Junior fullstack é um nível bem mais difícil de alcançar do que simplesmente back end ou front end.

Então eu focaria em algo. Como você já tem uma base legal de HTML e CSS eu focaria no front. Claro, se você curtir essa área.

Isso faz você se tornar um especialista de forma mais rápida porque o seu estudo fica direcionado.

Se você realmente seguir em front. Pega bem a base de HTML, CSS e JS. Adiciona um framework/ lib aí no seus estudos, podendo ser React, Vue, Angular. Cara, todas tem mercado. Algumas mais que outras, mas todas tem.

Se você dominar isso daí, um sistema de versionamento de código, conceitos de API, integração, responsividade, banco de dados (relacional ou nao), conceitos de UX e outros extras eu acho que você vai ter uma boa base p Junior. Ah! E pode aprender um nodezinho tb, claro. Sempre bem vindo. só não acho que deveria ser seu foco se você fosse trampar c front.

Eu mexia bastante c front e nunca usei node HAUSHSH

Uma dica extra é acompanhar o mercado. Pega o LinkedIn e sai olhando os requisitos das vagas. Vai te ajudar muito a entender o que você precisa estudar.",/r/brdev/comments/rlpac4/deleted_by_user/hphid9w/
apply,aplicar,brdev,hpo9gqx,1640260640,2021,2,"Primeiro escolha os países que voce gostaria de trabalhar, caso intencao seja se mudar e nao trabalhar remoto veja se as regras do pais possibilitam que voce possa conseguir visto 

De resto, comece a aplicar pra vagas e fazer entrevista hoje mesmo",/r/brdev/comments/rmc4x5/deleted_by_user/hpo9gqx/
apply,aplicar,brdev,hppajan,1640279143,2021,3,"Se você trabalhar 8 horas por dia e estudar mais 4 ou 5 horas você não vai absorver nada, da mesma forma que se não trabalhar e estudar 12 horas também vai absorver pouco, a não ser que você seja um super gênio robótico que consiga absorver tudo que leu e praticou nessas horas 

As vezes estudo 3, as vezes 2, mas a maioria dos dias nenhuma (lembrando que também estudo durante o horário de trabalho) tudo depende se quero aprender algo novo, se quero aprender algo que vou aplicar ou melhorar o que estou aplicando",/r/brdev/comments/rmwv2g/dica_pros_iniciantes_você_não_precisa_viver_sua/hppajan/
apply,aplicar,brdev,hpt1l5w,1640352930,2021,1,Quando eu fiz me falaram para aplicar novamente em seis meses.,/r/brdev/comments/rn741n/processo_seletivo_amazon/hpt1l5w/
apply,aplicar,brdev,hq2tj97,1640559494,2021,2,"Trabalhar pra fora remote não é tão difícil, o difícil é alguma empresa te levar lá pra fora, isso sim é raro.  
não tem caminho seguro ou garantido, vc precisa ser bom, fluente em inglês e aplicar assim como qualquer vaga no BR, consegui meu primeiro emprego pra fora com 3-4 anos de xp.",/r/brdev/comments/rp3lgs/qual_o_caminho_para_conseguir_empregos_de_dev/hq2tj97/
apply,aplicar,brdev,hq84qkk,1640657562,2021,2,"Só vai. Começa a aplicar, principalmente pra vaga jr. O que importa é experiência, e vc já tem. Não é só porque a nomenclatura do seu trampo nao é estágio que não considerem como experiência.",/r/brdev/comments/rpunry/duvida_sobre_estágio_ou_vaga_júnior/hq84qkk/
apply,aplicar,brdev,hq9g13u,1640686315,2021,3,acho que seria melhor vc compartilhar seu curriculo conosco (censurando dados pessoais) e nos te ajudamos a melhorar ele e vc aplicar pras vagas que vc quer do que essa... novelinha,/r/brdev/comments/rq9198/ajudinha_para_indicacoes_de_vagas_dev_jr_python/hq9g13u/
apply,aplicar,brdev,hqjshpz,1640874764,2021,7,"Bom, projeto é pra tu aplicar um conhecimento que tu está aprendendo naquele momento, não interessa se tu vai repetir o projeto várias e várias vezes, contanto que quando tu for refazer ele, tu coloque o que tu já sabe mais o que tu está vendo agora. 

Eu não sei nada de I.A, ou M.L então vou dar um exemplo de frontend.

Imagina um projeto de ""lista de tarefas"" (clássico hehehe).

1 - tu está aprendendo html + css, ai tu só faz um input mais um lista com umas tarefas e coloca um estilo qualquer com o css.

2 - tu agora está aprendendo javascript e chegou na parte de array. Agora tu faz o mesmo app e coloca uma ação para quando apertar o botão o valor do input se adicionado no array e ser exibido no console.

3 - tu continua nos estudos de javascript, agora tu sabe manipular o DOM, tu refaz o mesmo projeto agora quando clica no botão ao invés de exibir no console o array, tu vai fazer um map() no array e criar um elemento para cada item e exibi-lo na página.

4 - avançando no estudo de frontend tu parte pra bibliotecas e frameworks, por exemplo reactjs, agora tu repete o que tu fez usando reactjs e aprendendo a usar 'states' um hook do react.

5 - avançando com reactjs tu aprende sobre o hook useEffect() e como tu pode chamar um API com ele e renderizar as coisas na tela.

E por ai vai. Tu aprende algo novo e aplica em um mini projeto.

Quando tu pegar um vídeo desses de fazer um projeto completo, pra questão de estudo, tu não pega o projeto do inicio ao fim, tu avança até onde tu está entendendo, e quando tu não estiver mais tu pausa, revê o que tu não entendeu e tenta criar algo só com aquilo ali até que não esteja mais tão confuso assim.",/r/brdev/comments/rruoed/quando_começar_a_fazer_projetos_e_o_que_é_um/hqjshpz/
apply,aplicar,brdev,hqk8brb,1640881539,2021,2,">Quando tu pegar um vídeo desses de fazer um projeto completo, pra questão de estudo, tu não pega o projeto do inicio ao fim, tu avança até onde tu está entendendo, e quando tu não estiver mais tu pausa, revê o que tu não entendeu e tenta criar algo só com aquilo ali até que não esteja mais tão confuso assim.

Vlw pela dica, vou aplicar u.u",/r/brdev/comments/rruoed/quando_começar_a_fazer_projetos_e_o_que_é_um/hqk8brb/
apply,candidatei,brdev,herxe3g,1632951826,2021,2,"Dizem que a Cubos é boa, mas eu desisti deles desde que eu me candidatei a uma vaga de estágio front end e eles me reprovaram pq eu não tinha XP em React Native, Hooks, Redux e Router.

Tipo se eu soubesse bem React do jeito que eles queriam teria me candidatado a uma vaga de júnior e não de estágio.",/r/brdev/comments/py31zx/bootcamps_de_programação/herxe3g/
apply,candidatei,brdev,hfa4rzd,1633299572,2021,2,"Tenho a mesma dúvida. Já me candidatei a tudo aqui na cidade e nem deram retorno. Se alguém souber grupos de whats,telegram que postem estágios por favor, compartilhem aí.",/r/brdev/comments/q0rzbb/estão_tendo_muitos_estágios_ou_vagas_jr_para/hfa4rzd/
apply,candidatei,brdev,hg4nnto,1633888712,2021,3,"Enviei ~~mais de 80~~99 aplicações que vi no LinkedIn, InfoJobs e outros aí. Meti tudo numa planilha kkk

E pior que a empresa que me chamou foi a TERCEIRA EMPRESA QUE ME CANDIDATEI kkkkkkkkk",/r/brdev/comments/q55fpt/qual_foi_o_meio_pelo_qual_você_conseguiu_o_seu/hg4nnto/
apply,candidatei,brdev,hh88qkd,1634649076,2021,6,"Essa empresa tem histórico de ser uma das piores em questão de processo seletivo.

Dê um google em ""bairesdev cscareerquestions"" para ler algumas das experiências que a galera daquele subreddit teve com eles.

1 ano atrás eu me candidatei em uma vaga deles, e foi do jeito que você falou - muitos testes, alguns bem nada a ver e nunca sequer recebi um feedback.

Todo o modelo de negócios de empresas desse tipo é fazer propagandas voltadas para a massa e consequentemente contratar devs com um salário extremamente abaixo da média.",/r/brdev/comments/qb28cx/vaga_na_bairesdev/hh88qkd/
apply,candidatei,brdev,hin1h2t,1635599864,2021,3,"Eu faço a mesma coisa, sempre me confundo toda pq n sei pra das empresas q eu me candidatei eu tenho que ir, as vezes eu nem lembro mais da empresa",/r/brdev/comments/qit1oq/recebi_resposta_de_uma_empresa/hin1h2t/
apply,candidatei,brdev,hiwuwsa,1635790931,2021,3,"Eu candidatei a uma vaga bem remunerada e eles pediram um take home gigantesco com backend, front end extremamente específicos, teste unitário, docker, e os caraí. Eu simplesmente recusei e fazer por quê ia levar semanas. Se a empresa não valoriza seu tempo como candidato menos ainda como funcionário.",/r/brdev/comments/qkbgas/posso_recorrer_de_alguma_forma/hiwuwsa/
apply,candidatei,brdev,hkdp6z8,1636751540,2021,2,"Sem indicação, encontrei a vaga no LinkedIn e me candidatei. Na entrevista me perguntaram sobre OOP, SQL, Java, Rest e uma parte da entrevista em inglês. Uma das coisas que mais me ajudou foi estar cursando SI em uma faculdade bem conhecida, tinham outras pessoas na empresa formadas no mesmo curso.",/r/brdev/comments/qshak0/pergunta_para_aqueles_que_conseguiram_o_primeiro/hkdp6z8/
apply,candidatei,brdev,hmfo01t,1638127298,2021,5,"A vaga na empresa que estou agora não me candidatei, o tech lead viu meu perfil no linkedin e me mandou uma mensagem me chamando pra entrevista, mas normalmente sou eu que aplico mesmo.  
Não tenho muitos critérios cara, vejo que cumpro uns 70% dos requisitos técnicos da vaga, vejo se aceita remoto e se já tem funcionários brasileiros, pq já tive empresas que me recusaram por fuso, depois disso aplico e seja oq Deus quiser.  
Uso linkedin na maioria, mas comecei a usar o stackoverflow jobs ultimamente e gostei bastante.",/r/brdev/comments/r4700j/vc_quw_trabalha_no_exterior_como_foi_sua_história/hmfo01t/
apply,candidatei,brdev,hoz6vo6,1639780049,2021,29,"Tava na mesma situação há pouco tempo, e tenho algumas dicas para dar.

* Aplique para o máximo de vagas que der. Na época que estava atrás de vaga, eu ficava acompanhando diariamente o LinkedIn, Githubs com vagas (frontendbr/vagas e backend-br/vagas), Programathor, Glassdoor e Indeed. Eu buscava por vagas com as tecnologias que eu estou estudando (React e Node) e com júnior no nome.
* Dica importantíssima: tenha projetos próprios. Use as tecnologias que você aprendeu para criar um projeto próprio. Acho que isso me ajudou a se destacar. Não tinha experiência para colocar no currículo, então eu citei dois projetos que criei. Um mais simples só com front-end e outro um pouco maior, com front-end e back-end. Tente criar um projeto por conta própria, vê uma ideia que te interesse e faça algo relacionado.
* Vá se aprofundando nas ferramentas relacionadas com sua stack. Por exemplo, em vez de só aprender Javascript, HTML e CSS para front-end, vá além. Aprenda um framework (React, Angular, Vue), use Typescript, Styled Components, Sass, TailwindCSS, Bootstrap, Redux. Dê uma olhada nas vagas de emprego com as tecnologias que você está estudando e olhe os conhecimentos que eles pedem, lá geralmente eles citam esses tipos de ferramentas adicionais. Crie algum projeto usando a tecnologia e coloque no Github, para você poder citar em uma entrevista, por exemplo.
* Aprenda mais sobre testes. Pra Javascript temos o Jest, aí dentro do front-end temos o Testing Library, Cypress.
* Parece muita coisa para aprender para uma vaga de júnior, mas não precisa se tornar o mestre de cada uma das ferramentas, só ter utilizado em algum mini-projeto. O Google e Youtube estão sempre aí pra ajudar. Eu recomendo não copiar projetos, mas usar eles como base para fazer algo diferente.
* Recomendação: veja a possibilidade de trabalhar remoto, tem bastante oportunidade remota por aí.

Saiba que vai ser difícil mesmo, acho que eu me candidatei pra mais de 100 vagas. No final, só três empresas me passaram um desafio de programação, que foram bem simples (pelo menos para vaga júnior). O mais difícil foi de fato ser chamado para entrevista/desafio, acredito que por eu não ter indicação e estar no primeiro semestre da faculdade. Boa sorte com as vagas!",/r/brdev/comments/riqbwh/por_que_conseguir_um_primeiro_empregoestágio/hoz6vo6/
apply,candidatar,brdev,hc3i8w8,1631129949,2021,2,">Depende muito do país, alguns europeus vão achar caro já por aí, então sempre da uma olhada no Glassdoor da região pra fazer a pedida salarial.

Tava mais olhando mais pro EUA por causa do fuso, mas realmente é algo q vou ter q considerar pq n dá pra simplesmente descartar a europa. Claro, é uma pica o fuso mas dá pra relevar pra gana kkk.

>90% das US only te chutam pra fora do processo assim que descobrem que tu não ta por lá, o 10% que sobra é porque tu ta num fuzo horário próximo.

Pior q tbm n é só questão do fuso, mas tbm por causa de leis tributarias tbm.

Mas então se nem todas descartam, vou me candidatar do mesmo jeito, vai q cola kkkk.",/r/brdev/comments/pkd6ly/finalmente_fui_contratado_as_empresas_brasileiras/hc3i8w8/
apply,candidatar,brdev,hcr9lrf,1631577677,2021,7,"Provavelmente esse cara aí foi sorteado na loteria do azar. E a justificativa é tão idiota que me faz questionar se foi isso mesmo. Provavelmente foi culpa do RH.
Eu já cheguei a me candidatar pra vagas dessa empresa, acho que não mais.",/r/brdev/comments/pnowm8/nem_tudo_são_rosas_trabalhando_remoto_pra_fora/hcr9lrf/
apply,candidatar,brdev,hdwedqq,1632353023,2021,5,"Desenvolvedor Android aqui.

O mercado de desenvolvimento está super aquecido, estão abrindo vaga a cada segundo para devs não apenas para devs mobile, eu nunca gostei da ideia em ser autonomo em relação a desenvolvimento, acredito que peguei no máx 3 freelas para fazer. Em relação no sentido financeiro está muito bom também, está entrando no demanda x oferta (Muita vaga e pouca mão de obra)  


E como você comentou que na sua cidade não há oportunidades, hoje com a pandemia 90% das empresas estão contratando como full home office.

Te aconselho a procurar vagas no linkedin, deixar seu perfil bem arrumadinho e sair adicionando RH, tech recruiter e se candidatar em nas vagas que são abertas.",/r/brdev/comments/ptbudr/vale_a_pena_investir_em_programação_mobile/hdwedqq/
apply,candidatar,brdev,he1r93g,1632453840,2021,3,"Morae com meus pais não é problema pra eles, e nem pra mim.
Mas quero ter minha independência financeira para poder ir morar com minha namorada o quanto antes.

E não, nunca cogitei me candidatar para um PhD nos EUA, mas não descarto essa opção.",/r/brdev/comments/ptxoz0/focar_em_python_é_uma_boa_ideia/he1r93g/
apply,candidatar,brdev,he1siwj,1632454530,2021,2,"Cara, acho que você já consegue uma vaga, você tem domínio da linguagem. Eu estou migrando de python desktop pra python web, tem muita coisa a aprender sim, mas você tá bem adiantado. Conhecedor de Java tá em alta demanda. Continue estudando a playlist mas não deixa de candidatar. Acho que 6 meses você consegue algo nem que seja ganhando uns 2k",/r/brdev/comments/pua3jw/tentar_uma_carreira_as_cegas_ou_aceitar_uma/he1siwj/
apply,candidatar,brdev,hha3xlk,1634676824,2021,2,"OP, qual a diferença salarial exatamente? Você já considerou a hipótese de entrar na vaga que paga mais, e se candidatar para outras depois?

Trabalhar em uma grande empresa pode abrir muitas portas, se você seguir pelo caminho corporativo isso conta e muito, mas pelo que você disse a sua vontade é de trabalhar com tecnologias disruptivas e não ficar ""estagnado"".

Escolha difícil.

Eu trabalho com DevOps hoje e a área está cheia de oportunidades que pagam bem, mesmo para um dev. junior - que cá entre nós, se você se agilizar e começar a tirar certificações (AWS, Kubernetes, Docker, etc) desde cedo, o caminho de junior para pleno é bem curto.

Se comunicar em inglês é um grande plus também, mesmo que empresas gringas não peçam essa experiência, a prática vai ser muito importante se você um dia quiser sair do país ou trabalhar em uma empresa gringa, pode ter certeza que isso vai te ajudar.

No fim, acho que isso depende muito do momento de vida em que você está e de onde você quer chegar, só tome cuidado para não estagnar de fato, coisa que é muito **MUITO** fácil de acontecer em empregos corporativos (digo por experiência própria).

Boa sorte!",/r/brdev/comments/qbk7ie/deleted_by_user/hha3xlk/
apply,candidatar,brdev,hhdkqnr,1634746333,2021,1,"Não é exatamente chumbado que precisa de graduação pra fazer um estágio em TI. Você pode explicar sua situação pro recrutador. 

Os cargos em TI não são regulamentados, então você pode candidatar a uma vaga de Junior ou Trainee (ou qualquer nome que remeta começo de carreira) e avisar sua condição de faculdade ou até mesmo que nem está em uma.

Como não é regulamentado, você só precisar achar uma empresa que queira alguém começando e que não seja por exemplo *Programa de Estágio do Itaú*, que aí por ser uma empresa gigantesca eles fazem o link com sua graduação, provavelmente precisa do seu coordenador de curso assinar, faculdade autorizar e tudo mais. 

A única coisa que vai mudar é que não vão fazer um link da sua faculdade com seu emprego, mas você vai conseguir ter a exp na área e subir nos cargos.",/r/brdev/comments/qbr9e0/dá_pra_pegar_um_estágio_de_desenvolvedor_web/hhdkqnr/
apply,candidatar,brdev,hhi2jtm,1634830533,2021,2,"Sou dev jr e tenho uma tatuagem que fecha meu antebraço e pega um pedaço da parte de cima da mão. 

Até o momento não tive nenhum tipo de problema nesse sentido. Contudo, trabalho em uma startup, normalmente o ambiente nesse tipo de empresa é mais ""descolado"" e informal mesmo.

Acho que cabe também uma questão de você estudar/analisar a cultura da empresa para qual você tentará se candidatar, pra ter uma ideia de como é.

Vim de uma área bem mais ""restritiva"" que a área de tecnologia, e tenho a percepção que a área de tecnologia é muito mais permissiva nesse sentido, tenho dois amigos programadores plenos que possuem várias tatuagens e nunca tiveram problemas até onde sei, os dois trabalham pra uma multinacional inclusive.",/r/brdev/comments/qcsoyf/tatuagens_no_ramo/hhi2jtm/
