termo,query,subreddit,id,created_utc,ano,score,body,permalink
apply,aplicar,desabafos,hekroz0,1632822167,2021,0,"Acho que vc n entendeu o que eu quis dizer. Eu n estou falando que a matéria é inútil. Eu estou falando o seguinte: a aula que eu recebi sobre a matéria foi inútil. Nunca disse que literatura é inútil, eu disse que a AULA de literatura é. 

Sobre a 1° parte da mensagem, tudo bem uma determinada parte for ensinada, tipo biologia, vc explicar o que é uma bactéria (sem detalhar tanto), como elas se reproduzem (sem detalhar tanto)... mas, ainda sim, na forma naqual foi ensinada p/ mim (a crítica tem, desde sua origem, o meu ponto de vista) foi incrível inútil. Uma completa perda de tempo. E foi mesmo.

6 horas por dia, de segunda a sexta, jogando conteúdo no lixo, eu sei que tem determinadas coisas que são relevantes mas, falham na hora de serem ensinadas (filosofia é um ótimo exemplo) mas tbm admita minimamente que tem coisa inútil (história da arte serve p/ que?). Por isso eu n entendo essa pira de falar ""tudo é importante, tudo é relevante"" PÔ, SE TUDO É IMPORTANTE, NADA É IMPORTANTE! Se vc fala que algo é importante, vc obrigatoriamente vai ter que falar que outra coisa não é. 

Sobre o meu ""vies patético de quem gosta de exatas menospreza outras ciências"" de novo retomo o ponto inicial, a crítica é feita relativo ao que me foi passando e, daquilo que foi passado, o que é de fato relevante. BIOLOGIA NÃO É, QUÍMICA NÃO É, plmdds a aula de química que tem na escola é um desrespeito com todos os químicos que já existiram.

Professor: o átomo existe, tem níveis de energia e subníveis de energia.

Aluno: como vc sabe disso tudo?

Professor: se tá no livro é vdd

E é assim em TODAS as aulas de ciência e matemática. ""A fórmula resolve a questão"" ""pq?"" ""Confia"".

Sobre quando vc falou que, a discussão sobre qual matéria é ou não importante ser papo de gente burra, nmrl, falando na sinceridade, existem matérias importante e outra não importantes. Quem determina qual matéria é ou não importante? O sujeito que recebe a matéria. Se eu acho que x matéria não é importante, ela, para mim, não é. Se vc acha que é, p/ vc, é. Se tudo é importante então eu tenho que estudar de tudo, ótimo, lindo e maravilhoso, partiu botar na escola ""como trocar um motor de um carro"" já que ToDaS aS MaTeRiAs SãO iMpOtAnTeS, então essa tbm é. Pq eu n posso usar o tempo que estaria estudando o motor de um carro e lendo um livro de matemática? Está é a minha crítica. Pq eu n posso usar o tempo gasto em matérias inúteis e aplicar o mesmo tempo em matérias uteis? 50min de educação física, 50 de história da arte, 50 de atualidades, 50 da própria matemática que tanto amo (mas odeio a aula), pq n posso pegar esse tempo e usar p/ me deliciar nos meus queridos livros que tanto quero ler? Enfim, se vc me convencer que se eu n tivesse essas matérias (tipo história da arte) eu seria automaticamente um jumento que n saberia de nada (como se a escola mudasse alguma coisa) eu n vou mudar de idéia. Pq, essa é a base da minha crítica

Agora, p/ de supor coisas que n falei, o fato de eu falar ""p/ mim essa matéria é inútil"" (como disse em biologia e dei a entender durante todo o texto) n significa que eu a acho inútil p/ todos os casos. Esta escrito muito bem, PARA MIM É INÚTIL.

Resumindo: escola é um gasto desnecessário de tempo. Change my mind",/r/desabafos/comments/pwfu01/isso_tem_que_ser_discutido_abertamente_em_algum/hekroz0/
apply,aplicar,desabafos,hekw34d,1632825796,2021,1,"> Ela recentemente terminou um mini cursinho pago de sobrancelha, mas não ta buscando ver os materiais pra começar e nem divulgação

Não ignorando todo o contexto, mas vale perguntar: ela *realmente* quer isso ou ela fez por curiosidade e seguiu até o final (ou vai ver só fez pra ter alguma coisa pra colocar no currículo como é o caso de quase todos os MOOCs que eu fiz até agora)?

Pergunto isso por ser uma pergunta importante mesmo. Eu me encontro em uma situação similar de vida (tenho 22 pra contexto) e, embora esteja sendo pressionado pra arranjar *QUALQUER* coisa aqui em Londrina ou vazar logo pra São Paulo/SP com um cara (algo que só não aconteceu ainda por ele estar tentando desde o ano passado arranjar um emprego que não seja fisicamente pesado), eu tô me sentindo acomodado. Detalhe que a minha situação é similar à dele, mas não venho tentando tanto assim de uns meses pra cá. Desanimei e desanimei com força.

Tô tentando achar alguma coisa aqui e ali, mas nada clica. Tento começar alguma coisa, mas eu perco o restinho de vontade que eu tinha depois de alguns dias (ou algumas horas) vendo sobre alguma área aí.

Acho que vale tentar ir um pouco mais a fundo pra saber o porquê de ela não estar tentando tanto arranjar um emprego e coisas do tipo. Eu sei quais são os meus rolês (andei pensando nisso tudo durante um ano praticamente, hah) e vai ver temos aspectos similares - é muito tempo e muito esforço pra pouco ganho (no caso da maioria dos trabalhos possíveis) e é muito esforço pra uma chance um pouco maior de conseguir algo melhor (no caso de ser um curso que é bem procurado e tal). Pode ter o rolê de não conseguir encontrar uma área que pareça palatável, pode ter o rolê de não estar com a água batendo na bunda, pode ter o rolê de saber que vai fazer um trabalho ruim... todos esses pontos poderiam se aplicar à mim de alguma forma ou de outra.",/r/desabafos/comments/pwp0og/minha_namorada_não_faz_nada_pra_arranjar_emprego/hekw34d/
apply,aplicar,desabafos,helhpn9,1632837997,2021,5,"A teoria não é muito problemática em português. É que as escolas focam em decorar nomes de coisas e definições mais do que em aplicar os conceitos gerais.

Então, o melhor é ler.",/r/desabafos/comments/px4rwb/pqp_odeio_esse_tipo_de_humor/helhpn9/
apply,aplicar,desabafos,hemevb6,1632851797,2021,0,"Se for aplicar essa linha de raciocínio, então podemos chamar nossos amigos de preto, paraíba..  
As palavras carregam um significado e uma história consigo, pelo mesmo motivo brancos não podem pronunciar a n-word.",/r/desabafos/comments/px4rwb/pqp_odeio_esse_tipo_de_humor/hemevb6/
apply,aplicar,desabafos,henttn3,1632874146,2021,1,"É óbvio que vai estar ansioso. Provavelmente não sabe estudar corretamente e nem como direcionar o estudo e estudar o que mais importa. Não saber para onde olhar e como olhar gera uma ansiedade dentro de qualquer pessoa, ou melhor, um estado ansioso. 

  
Há uma dualidade entre a habilidade e a dificuldade, porque qualquer desafio que aparece na sua frente é encarado como uma atividade de grande dificuldade, e aí por isso que a sensação de fracasso toma conta da sua vida. Você se sente assim porque enxerga que tem pela frente um grande desafio e pouquíssima habilidade para lidar com ele. É totalmente desanimador, eu sei.

  
Mas, antes de querer aprender o conteúdo, precisa aprender e aplicar técnicas de estudo. Não é da noite para o dia. É uma preparação que leva anos. Comece hoje e evolua a cada dia. 

Por ora, diminua o ritmo na universidade, fazendo menos disciplinas, e foque no trabalho, pois é isso que te traz dinheiro.",/r/desabafos/comments/pxivii/tô_me_sentindo_um_lixo_por_causa_do_ead/henttn3/
apply,aplicar,desabafos,heodt5q,1632883565,2021,1,"Te entendendo e constantemente penso sobre como a vida, de fato, não tem muito sentido e as pessoas vivem bem com isso.

As coisas só parecem ter sentido enquanto não concluídas..uma vez que vc chegue lá aquilo já não vai mais te satisfazer. Não importa onde vc esteja, na minha opinião.

Isso é o que percebo que reflete em mim, pode não aplicar tanto pra você. Pra aliviar eu jogo esse jogo, então. Penso em objetivos que não conquistei, o que está pra vir e fico nessa. Não sei se é o ideal, mas alivia e me motiva. Mas tem vezes que realmente dá uma pegada mais forte e fico paralisado pensando como as coisas n fazem sentido e como elas poderiam ser diferentes por um milhão de motivos, muitos deles fora do nosso alcance.",/r/desabafos/comments/pxl7ld/aquela_história_de_sempre/heodt5q/
apply,aplicar,desabafos,heolsfi,1632887770,2021,3,"OP, vivi com meus pais até bem mais do que meus 30 anos, hoje moro só, dá um aperto no peito de ter me afastado de tudo e de todos, mas em compensação dá p ter uma liberdade, sem ninguém pegar no pé, e mesmo com uma aparente estabilidade e tranquilidade é necessário estudo constante, se aprimorar cada vez mais pois os desafios chegam a todo momento. Mesmo assuntos que não sejam da minha área tenho curiosidade e se der p aplicar melhor ainda. Então, o q tenho p dizer: não se sinta derrotado, tenha fé que tudo passa, é só uma fase. Tem pessoas q têm ótimas condições financeiras,  tem tudo, casa, carro do ano, uma família unida, e mesmo assim não passam bons momentos, enfrentando seus conflitos internos.",/r/desabafos/comments/pxhjad/deleted_by_user/heolsfi/
apply,aplicar,desabafos,hesnviu,1632964240,2021,3,"   Mano, passei por coisa semelhantes. Infelizmente somos sujeitos a esse processo intelectual de ter que estudar assuntos específicos que não vão ser úteis na área que escolhemos. Pra vencer isso eu tentei achar coisas que eu tivesse prazer em estudar, atualmente tô estudando violino e isso funcionou pra mim como uma forma de ""descansar"" mentalmente ( embora eu ainda esteja usando meu cérebro pra aprender algo ) e assim esse prazer no saber foi voltando aos poucos. 
   Não sei se te ajudaria encontrar algo que tu gostasse de aprender pra tentar ter esse prazer de estudar de novo e aplicar isso nos seus estudos, mas de qualquer forma torço por ti",/r/desabafos/comments/py82vs/não_sinto_mais_prazer_em_estudar/hesnviu/
apply,aplicar,desabafos,hevtdeu,1633027934,2021,2,Eu tenho hiperidrose também e meio q já desisti. Já usei muitos produtos e nada funcionou. Só q a minha é muito ligada à ansiedade. O q eu vejo o povo falar é q aplicar botox as vezes funciona. Também tem uma cirurgia meio perigosa e q pode causar suor compensatório. Acho q o melhor q vc pode fazer é ir na dermato e perguntar sobre as opções e a cirurgia...,/r/desabafos/comments/pypzky/deleted_by_user/hevtdeu/
apply,aplicar,desabafos,hewm9wb,1633040582,2021,0,"Vc é um cara obstinado, só tem que aplicar essa determinação em algo produtivo",/r/desabafos/comments/pyrzch/gente_eu_nao_sou_normal_lkk_eu_quebrei_de/hewm9wb/
apply,aplicar,desabafos,hewv5sb,1633044850,2021,1,">i por coisa semelhantes. Infelizmente somos sujeitos a esse processo intelectual de ter que estudar assuntos específicos que não vão ser úteis na área que escolhemos. Pra vencer isso eu tentei achar coisas que eu tivesse prazer em estudar, atualmente tô estudando violino e isso funcionou pra mim como uma forma de ""descansar"" mentalmente ( embora eu ainda esteja usando meu cérebro pra aprender algo ) e assim esse prazer no saber foi voltando aos poucos. Não sei se te ajudaria encontrar algo que tu gostasse de aprender pra tentar ter esse prazer de estudar de novo e aplicar isso nos seus estudos, mas de qualquer forma torço por ti

Sim, eu tenho coisas que gosto de estudar também, amo neuro, psico, etc, mas o vestibular não cobra essas coisas, dai tenho q me obrigar a estudar coisas que não gosto, mas que bom que conseguiu voltar a ter amor pelos estudo. Eu acho que vou ter q fazer o mesmo, abrir um pouco mão do que tenho de obrigação para focar um pouco no que me da felicidade",/r/desabafos/comments/py82vs/não_sinto_mais_prazer_em_estudar/hewv5sb/
apply,aplicar,desabafos,hexe5mw,1633054127,2021,1,"Oush e quem falou em chip?? O OP reclamou dos possíveis efeitos colaterais no longo prazo (já que a população está meio que sendo cobaia disso né, vamos descobrir o que acontece depois de 5 anos de ter tomado a vacina). 

Vc basicamente disse: não tem chip (óbvio); não é veneno (também óbvio); não da nada no dia seguinte (a questão é no longo prazo); não dói aplicar injeção (dói sim, inclusive tenho fobia mas todo ano tomo a da gripe)",/r/desabafos/comments/pyxruv/deleted_by_user/hexe5mw/
apply,aplicar,desabafos,hez20s4,1633095272,2021,2,"Um misto de sorte e timing.

Tava procurando, já tinha feito algumas entrevistas e do nada apareceu um BR (ainda trabalha comigo) me oferecendo a vaga. Olhei os requisitos, que tavam bem acima do meu nível e neguei. Mas ele insistiu tanto que eu decidi aplicar. Fiz um teste técnico (gastei o fds todo, devo ter demorado umas 20 horas) e passei. Fácil assim. kkkk

O segundo trampo part time que tenho eu tava de bobeira jogando conversa fora no Twitter, e apareceu um BR que mora nos EUA falando que tinha uma empresa de outsourcing pra pegar dev BR e oferecer pra empresas de lá. Troquei uma ideia com ele, conversamos sobre skill e idiomas e ele começou a caçar oportunidades pra mim. To há 3 semanas nesse novo trampo.

TL;DR: tem que fazer networking, se envolver em comunidades e sempre buscar aprender coisas novas. Com o tempo ""na pista"" as coisas começam a aparecer. Ah, é bom deixar um pouco o medo de lado tbm. Meu inglês tá longe de ser fluente, mas eu consigo me fazer entender. Isso já basta.",/r/desabafos/comments/pyi1f2/se_você_não_sabe_debuggar_um_código_você_não_é_um/hez20s4/
apply,aplicar,desabafos,hf06ooi,1633113090,2021,2,"Tem outra ferramenta, na aba superior vc vai ver um link escrito ""Vagas"", só clicar lá e aplicar os filtros de acordo com o que e como vc quer trabalhar. Depois só se aplicar pras vagas que vc quer, algumas vagas tem a ""Candidatura Simplificada"" que é feita com os próprios dados que vc já colocou no LinkedIn, mas a maioria te leva pra um link de cadastro no site da empresa ou empresa de contratação parceira.",/r/desabafos/comments/pzdv72/como_funciona_mesmo_o_linkedin_fico_atrapalhado/hf06ooi/
apply,aplicar,desabafos,hf1d6ww,1633132957,2021,6,"Obrigado pela dica, vou aplicar de agora em diante, aliás, meu fone só está funcionando de um lado ;-;",/r/desabafos/comments/pzi6ed/pq_fone_de_ouvido_não_dura_nada/hf1d6ww/
apply,aplicar,desabafos,hf1n9xq,1633137946,2021,2,"Tem tratamento(s), mas não tem cura. Eu já pingo 2 colírios e tomo uma vitamina. Teria a injeção intraocular de 3 em 3 meses; pra aplicar, usam anestesia, claro, mas precisa estar acordado. Ainda não tenho nervo pra isso.

Sua sensação com o laser foi como? Eu fiz uma operaçãozinha com laser (iridectomia) uns meses atrás e foi uma merda hahaha",/r/desabafos/comments/pzf5s0/minha_doença_no_olho_que_parecia_não_ter_reversão/hf1n9xq/
apply,aplicar,desabafos,hf70sc4,1633241696,2021,1,"Cara, tente aplicar a filosofia do estoicismo.
Se está ao seu alcance, trabalhar para alcançar.
Se não está não seu alcance, nem pense sobre.
É foda estar lá e não poder participar dos mesmos papos. Mas acontece e é sobre isso.",/r/desabafos/comments/q0bwkz/só_um_desabafo_de_quem_não_se_encaixa/hf70sc4/
apply,aplicar,desabafos,hf8ywbn,1633282469,2021,4,"Então, eu imigrei em 2009, nessa época o Canadá estava com vários programas de imigração. 

Na época que eu vim, eu tinha acabado de terminar meu bacharelado no Brasil e vim fazer um intercâmbio de um ano pra aprimorar o inglês. Nesse período eu consegui um emprego de meio período na Pizza Hut fazendo a massa as 5 da manhã e o empregador decidiu aplicar para que eu pudesse extender meu visto de estudante/trabalho. 

Após alguns anos trabalhando para esse empregador, eu fui promovido algumas vezes, até me tornar o gerente geral do restaurante. Com isso eu me enquadrava em um dos programas de imigração disponíveis nessa época (skilled worker program).

Assim que consegui me tornar residente permanente, eu nao precisava estar vinculado a esse restaurante e poderia trabalhar em outros lugares. 

Então, depois de 3 anos trabalhando no restaurante eu troquei de emprego (área de restaurantes nunca foi minha praia), troquei de área e fui devagar sendo promovido até chegar a uma posição de gerência. 

No quinto ano de Canadá eu pude aplicar para a cidadania e deu tudo certo. Hoje faz mais de 10 anos que moro por aqui e estou muito feliz. 

-------

Se tiver interesse, entre o site de imigração do Canadá e dê uma olhada em qual programa você se encaixaria e aplique, talvez demore o processo, mas isso é devagar mesmo. 

Website: https://www.canada.ca/en/services/immigration-citizenship.html

*Em nenhum momento estive ilegal no país e não recomendo a ninguem a fazer isso.",/r/desabafos/comments/q0b2f7/fiquei_bonito_depois_que_virei_bem_sucedido/hf8ywbn/
apply,aplicar,desabafos,hf8yymu,1633282495,2021,3,"Então, eu imigrei em 2009, nessa época o Canadá estava com vários programas de imigração. 

Na época que eu vim, eu tinha acabado de terminar meu bacharelado no Brasil e vim fazer um intercâmbio de um ano pra aprimorar o inglês. Nesse período eu consegui um emprego de meio período na Pizza Hut fazendo a massa as 5 da manhã e o empregador decidiu aplicar para que eu pudesse extender meu visto de estudante/trabalho. 

Após alguns anos trabalhando para esse empregador, eu fui promovido algumas vezes, até me tornar o gerente geral do restaurante. Com isso eu me enquadrava em um dos programas de imigração disponíveis nessa época (skilled worker program).

Assim que consegui me tornar residente permanente, eu nao precisava estar vinculado a esse restaurante e poderia trabalhar em outros lugares. 

Então, depois de 3 anos trabalhando no restaurante eu troquei de emprego (área de restaurantes nunca foi minha praia), troquei de área e fui devagar sendo promovido até chegar a uma posição de gerência. 

No quinto ano de Canadá eu pude aplicar para a cidadania e deu tudo certo. Hoje faz mais de 10 anos que moro por aqui e estou muito feliz. 

-------

Se tiver interesse, entre o site de imigração do Canadá e dê uma olhada em qual programa você se encaixaria e aplique, talvez demore o processo, mas isso é devagar mesmo. 

Website: https://www.canada.ca/en/services/immigration-citizenship.html

*Em nenhum momento estive ilegal no país e não recomendo a ninguem a fazer isso.",/r/desabafos/comments/q0b2f7/fiquei_bonito_depois_que_virei_bem_sucedido/hf8yymu/
apply,aplicar,desabafos,hfa9vjh,1633301841,2021,1,"Pode dar uma desbotada nas cores. Agora, se a mancha amarela permanecer, aí é aplicar uma pequena quantidade de água sanitária, o que vai remover por completo a mancha, mas que deixará mais desbotado. Faz primeiro o processo com o bicarbonato de sódio até o fim. Se houver mancha, aí faz o processo da água sanitária. É só tomar cuidado na hora que não tem erro. Qualquer coisa me chama no chat e/ou pede ajuda para a sua mãe aplicar a água sanitária.",/r/desabafos/comments/q0k5np/fudeu_tudo/hfa9vjh/
apply,aplicar,desabafos,hfb31v9,1633316166,2021,4,"Maninho, como tatuador(iniciante kkk) tenho umas coisas a comentar, cabe a vc decidir se é pertinente.

Primeiramente espera mais um pouco, até ser maior de idade. A cabeça da gente muda bastante em dois ou três anos( beleza que em meses vc já vai ser “adulto”, mas é bom considerar mais experiência, se posso chamar assim)

Na parte dos empregos, isso depende. Existem vários médicos, advogados, empresários, gerentes, motoristas, etc. tatuagem nada mais é do que uma arte, a visão do mundo em relação a arte tem mudado bastante ultimamente.

Procura um profissional bacana que saiba aplicar bem o maori, e cuidar bem na cicatrização.

Tenta dar uma pesquisada na cultura maori também.

Minha primeira tatuagem foi aos 18, não me arrependo pq é algo que amo de paixão, em casa foi tranquilo. O pior é parente com mais idade que olha torto por um ou dois dias e depois começam a perguntar “dói muito? “Eu acho até legal, mas deve ser caro né?” “Qual o significado?(nutri um ódio absurdo por essa pergunta específica).

Espero ter ajudado.",/r/desabafos/comments/q0vq00/tatuagem/hfb31v9/
apply,aplicar,desabafos,hfb9gse,1633319523,2021,-1,"Tá sabendo muito, heim. CRP fiscaliza PSICÓLOGOS. O CRP não fiscaliza pessoas sem formação que querem dar uma de psicólogo. Eu tive um professor no Ensino Médio que fingia que fazia orientação vocacional. Formado em biologia, ele colocava um monte de aluno na frente do PC pra fazer teste na internet e cobrava 400 reais de cada um. O CRP não pode fazer NADA porque ele não é psicólogo. Inclusive querem liberar testes psicológicos pra qualquer profissional da saúde poder aplicar, sem qualquer respaldo teórico ou noção. E você tem cara de ser um amargurado do caralho com essa arrogância toda. Além de não ter noção do que é o estado mental de uma pessoa com ideação suicida. Tu quer colocar alguém que só sabe repetir frase de efeito ou que apela pra religião do outro lado da linha de alguém que tá destruído psicologicamente? Óbvio que existem psicólogos ruins, mas a chance de alguém preparado pra lidar com isso fazer merda é menor. Restringir a participação somente a estagiários ou profissionais de psicologia já ajudaria muito a elevar a qualidade do serviço. E tu fala demais. Tá achando ruim pedreiro metido a engenheiro, não tá? Você moraria num prédio construído e planejado por pedreiros? Acho que não, né? Só saúde mental que pode ser uma bagunça. Ao invés de defender políticas públicas, prestação de serviço à saúde mental de qualidade, contratação de mais profissionais no SUS você tá aqui defendendo isso. Lamentável.",/r/desabafos/comments/q0nfjz/sinto_que_meu_diploma_não_tem_valor_e_saúde/hfb9gse/
apply,aplicar,desabafos,hfdow24,1633371171,2021,2,"Você precisa recolher os sentimentos e as sensações de atividades que o deixe solto e natural e aplicar isso no seu meio cotidiano. Pois ninguém vai te achar estranho se você simplesmente agir como se não esperasse nada demais. Ser educado já é um fator legal e mesmo que não seja puxando assunto, sempre deixe espaço para a pessoa continuar a conversa",/r/desabafos/comments/q1ayg8/eu_penso_no_meu_futuro_como_raios_eu_vou_lidar/hfdow24/
apply,aplicar,desabafos,hfgqf09,1633431044,2021,6,"Não vai acabar não mano, não se preocupe. Em todo país do mundo que o capitalismo foi o sistema econômico escolhido diminui absurdamente a pobreza.

O capitalismo não é controlado pelos empresários malvadões que só pensam em lucro a todo custo, ele é controlado pelos consumidores, esses sim ditam o capitalismo, se uma empresa faz ações antiéticas os consumidores poderiam muito bem parar de consumir os produtos ou serviços dessa empresa (fora que tem o governo para fiscalizar e aplicar punições).

E sobre a questão ambiental, existem muitas empresas que fazem um bom trabalho nesse setor e ajudam com a sustentabilidade, tipo a natura, e cabe aos consumidores e ao governo criar incentivos para que as demais empresas sigam um método de negócio mais sustentável.",/r/desabafos/comments/q1m5gw/o_capitalismo_irá_acabar_com_o_mundo_e_não_vai/hfgqf09/
apply,aplicar,desabafos,hfi0qo6,1633453638,2021,1,"O incrível é que estamos falando de custo e você pega sua resposta que se baseia na renda em si para aplicar um ideal filosófico. Ótima maneira de mudar o intuito da pergunta. Pagar mais caro para ter um nutriente com muito mais qualidade é algo errôneo, mas trocar aparelhos celulares todo ano por outro que mal muda na qualidade do seu produto é algo totalmente viável, o que é irônico na visão da atualidade, espero que não seja uma dessas pessoas :)  


Você é livre para me considerar negacionista, mas não muda o fato de sua característica arrogante se demonstrar por trás das redes sociais...",/r/desabafos/comments/q1rr47/virei_vegetariana_e_não_aguento_mais_piada/hfi0qo6/
apply,aplicar,desabafos,hfi7jf0,1633456513,2021,11,"É sempre importante trabalhar juntos e com respeito mas é igualmente importante aplicar um tipo de hierarquia para evitar esse tipo de situação.

Os funcionários estão olhando para você como se você fosse colega de trabalho ou amiga.

Se não cortar esse tipo de atitude vai acabar gerando mais desrespeito e conflitos...",/r/desabafos/comments/q1wd3b/eu_e_meu_namorado_somos_patrões_mas_só_ele_é/hfi7jf0/
