termo,query,subreddit,id,created_utc,ano,score,body,permalink
apply,aplicar,desabafos,hokljo1,1639522370,2021,1,"A minha pele sempre foi muito boa, mas alguns remédios que eu uso causam acne como efeito colateral. Estou usando tretinoína 0,5mg/g (Vitacid) para prevenção. Precisa usar durante a noite e aplicar muito protetor ao longo do dia (quantidade adequada e muitos retoques), porque a pele fica inflamada e pode manchar. No começo do tratamento piora, mas depois fica muito melhor. O medicamento também previne rugas. Não precisa de receita, mas o ideal é conversar com um dermatologista antes de usar.


Eu gosto dos cométicos:

Fisiogel sérum A.I. (para a vermelhidão), CeraVe loção facial hidratante, Natura fotoequilíbrio FPS 60 (existem duas versões, mas a versão para pele oleosa é melhor), Actine color FPS 70, Nivea beauty expert FPS 50 (ambas as versões são ótimas), Filtrum gel-creme hidratante FPS 50 (vem 120g de produto) e o Sallve FPS 60 (demora um pouco para secar). Eu usei o Australian Gold facial FPS 50, achei muito seco, porém se a sua pele for oleosa vai funcionar bem. Já ouvi falar muito bem do sabonete Actine para pele acneica, mas eu nunca precisei dele.

Eu uso vaselina sólida ou bepantol nas pálpebras superiores e inferiores.",/r/desabafos/comments/rgir42/espinhas/hokljo1/
apply,aplicar,desabafos,hounpyp,1639700412,2021,2,"Queria muito não concordar contigo, mas é a pura verdade. Tem muita coisa boa lá fora q funciona porque os caras tem uma cultura completamente diferente da nossa e q se tentassem aplicar aqui simplesmente não ia rolar. Eu acho isso deprimente, de verdade",/r/desabafos/comments/ri2yaj/temos_que_entender_de_uma_vez_por_todas/hounpyp/
apply,aplicar,desabafos,hovci2f,1639711562,2021,2,Pode aplicar para vagas de home office de empresas de outras cidades,/r/desabafos/comments/ri60ma/um_pouquinho_de_rage/hovci2f/
apply,aplicar,desabafos,hoxma6x,1639757800,2021,1,"Pode sim, geralmente se for dentro da sua casa eles não vão pegar pq não pode entrar na sua casa sem um mandato, porém nesse caso então eles vão te aplicar uma multa fudida fora o esculacho, agr se for na rua na segunda vez eles já pega o som e leva kkkk",/r/desabafos/comments/rhy3so/posso_denunciar_no_190_o_som_alto_do_vizinho_de/hoxma6x/
apply,aplicar,desabafos,hoxupoa,1639760985,2021,2,"Obrigado pela resposta, o meu lance nao e o trabalho saca tipo e um trabalho tranquilo e tals ate pela pouca carga horaria.

O q vem me incomodando (acho q nao ficou claro no texto) e o lance de nao Ta com força/animo nem ao msm pra atividades q me dariam alguma alegria ou distração.

Curto muito programação e tals e adorava aprender as linguagens a sensação de crescimento q dava ao entender e conseguir aplicar algo. Mas nem isso tenho tido mais sento abro um código e fecho o msm pra jogos ou musica,sinto como se tivesse saturado de Td.",/r/desabafos/comments/rig7gz/estagnação/hoxupoa/
apply,aplicar,desabafos,hoxztkt,1639762941,2021,5,"Porque somente o acesso a elas é público. Você pode até entrar, mas se quiser ficar, deve se adequar aos padrões impostos na comunidade. Simplesmente é algo que não tem o que fazer.

Se quiser continuar frequentando a comunidade do jogo, você terá de aguardar os três dias de suspensão. Se é uma regra do sub, e você desobedeceu, sabendo disso, você automaticamente se sujeitou a receber essa punição.

Repito: todas as comunidades privadas, mesmo as de acesso público, funcionam assim. Não tem outra alternativa a não ser aceitar isso.

\_\_\_\_\_\_\_\_\_\_\_\_\_\_\_\_\_\_\_\_\_\_\_\_\_\_\_\_\_\_\_\_\_\_\_

Vamos usar um retórica aqui pra ver se você entende melhor:

Aqui no desabafos, julgar o autor é proibido, visto que é uma comunidade para isso, desabafar, e não faz sentido ser julgado quando se está desabafando, se eu viesse aqui na sua thread e no lugar de explicar pra você sobre regras privadas em comunidades privadas eu resolvesse atacar você pelo que você está relatando aqui, e fosse banido por isso, bem, os moderadores teriam completa razão em aplicar esta punição, porque está explícito no sub que esse comportamento não é tolerado aqui.",/r/desabafos/comments/rilidg/ontem_aconteceu_algo_muito_ruim/hoxztkt/
apply,aplicar,desabafos,hp1qi83,1639835893,2021,2,"Mano, tudo num relacionamento é resolvido a base de conversa! Tente levar isso pra sua vida e aplicar o máximo possível, é difícil, mas o que ela tá fazendo pode ser pra chamar atenção ou filha da putisse e você só vai descobrir conversando.",/r/desabafos/comments/rimxzh/meu_namoro_não_anda_tão_bem/hp1qi83/
apply,aplicar,desabafos,hp3mn1y,1639867485,2021,2,"Sim, só estranho mas só foram exemplos kkkk

A cara magina, tô aqui pra ajudar e ser ajudado também. 

Mas de fato ao sermos atraídos olhamos pra pessoa com tanto desejo que acaba o tornando mais especial que uma pessoa e isso não é um mal, mas talvez seja algo que não devemos aplicar de primeira vista, pois beleza é algo que sim nos atraí mas as vezes a pessoa não é tão bonita por dentro e nos dá uma sensação de ""mas que caca que eu fiz"", se é que me entende. 

Kkkk",/r/desabafos/comments/rjh981/chegar_na_gata/hp3mn1y/
apply,aplicar,desabafos,hp4hxi5,1639883156,2021,15,"Doidão, tem medico que vê mais rola que puta. É um negócio que precisa olhar tlgd, não é bom ficar empurrando com a barriga doenças, principalmente a ist. A sua rola é a unica coisa que vai estar contigo para todo o momento sabe, pelo menos cuida dela logo e volta a ter uma vida normal. 

Vergonha é normal tlgd, eu mesmo ja tirei um cisto do meu pau e porra, foi foda pra caralho. Eu fiquei segurando o menino la de lado e o medico enfiando agulha para aplicar xilocaína e anestesiar, depois fiquei vendo ele passando o bisturi e eu sentido de leve os cortes, pele sendo cortada, vendo o meu sangue sair pelo meu pau, ele tirando os nervos do cisto e puxando... Enfim, não doeu, o medico foi brabo, deu os pontos e tirei esse problema de mim. Acabou em 30 minutos.

O que vai acontecer contigo é bem mais suave. O medico(a) vai estar no consultório, tu vai explicar, ele vai pedir para tu deitar enquanto ele coloca as luvas, tu vai abaixar so a cueca, nem pelado vai ficar, ele vai ver o seu menino la, provavelmente ele vai puxar o prepúcio (caso tenha) para ver a glande, vai diagnosticar e no maximo vai coletar uma amostra e levar ao laboratório para confirmar. Depois disso ele vai te passar uma pomada ou remédio e em 15 dias tu vai voltar para lá e fazer a checagem... Tudo isso vai durar nem 15 mim, confia",/r/desabafos/comments/rjmghi/tomei_no_cu_e_to_com_candidiase/hp4hxi5/
apply,aplicar,desabafos,hp88jdx,1639956145,2021,1,"Meu sonho e objetivo é me mudar daqui, ir para o Canadá, não desisto da faculdade por isso e estou quase terminando.
Próximo passo é arrumar emprego e continuar na casa dos pais, juntando o máximo de grana para aplicar ao visto.
Se não certo eu irei procurar outro país, tenho umas 3 opções como segundo plano, porém nunca fui atrás de pesquisar a fundo sobre eles.
Na pior das hipóteses, se ficar aqui o não desistir significa não morrer de fome, afinal está ruim e tende a piorar enquanto tivermos um lunático inútil  no comando do país, só q qnd isso mudar, aos poucos as coisas vão melhorar e quem sabe possa surgir algo bom.
Família do meu pai tinha o básico e da mãe um pouco menos, porém não passava fome, eles nunca deixaram se abater, estudaram, trabalharam e hoje colhem os frutos, então tenho também o exemplo que o melhor é batalhar e pq assim se chega em algum lugar.",/r/desabafos/comments/rk8gsa/como_você_não_desanima_sabendo_da_situação_atual/hp88jdx/
apply,aplicar,desabafos,hpa4053,1639996016,2021,1,"o ideal é vc pesquisar por conta propria tambem. acho q eu tenho tanta facilidade em ter sucesso com terapia pq consigo aplicar a teoria na minha propria vida e falo sobre isso nas sessões. sirvo como um objeto de estudo pra mim mesma.

e tambem depende do psicologo, nao so da abordagem. dito isso, faço terapia com uma sexologa mas ja associei minhas questões com a psicanalise hauahau  enfim, cada caso é um caso. e cada psicologo tera um olhar diferente.

o ser humano é igual uma cebola. tem a camada externa. acreditamos q nossa questão é sobre isso. mas conforme vc vai aprofundando, vc vai perceber que aquela questao foi apenas fachada, e que ha um fundo emocional que provocou tal.

no caso da psicanalise temos sintomas. quais vc tem? como elas se expressam? exemplo é um caso de um rapaz que tinha herpes toda vez que marcava um encontro. superficialmente, acredita-se que o herpes precisaria ser resolvido, mas na verdade, é o fundo emocional. aquilo que faz ele temer se relacionar e a disponibilidade e vontade de integrar tais emoções.

quando se trata de sexo e repressão, vc recusa sua parte sexual como diferente ou separado de si. mas o inconsciente ainda sente vontade de se relacionar, entao pra poder ser capaz de se relacionar, vc precisa integrar essas partes em si que vc reprimiu, recusou, rejeitou.",/r/desabafos/comments/rk69hg/tenho_29_anos_e_nunca_fui_sexualmente_ativo_e/hpa4053/
apply,aplicar,desabafos,hphmyhw,1640130081,2021,2,"Fiz frenuloplastia pra corrigir o freio curto do penis. Optei por anestesia local, porque a geral ia ser muita burocracia e ia demorar pra conseguir (fiz pelo SUS). 
A dor de sentir a injeção colocando anestesia no penis foi muito angustiante. Começou a escorrer umas lágrimas e a enfermeira ficou me consolando, e o médico parou de aplicar e ainda gritou comigo: “se quiser eu paro a anestesia e faço sem anestesia mesmo, mas vai ser pior”. Daí respirei um pouco e mandei continuar o sofrimento.",/r/desabafos/comments/rljzp0/desabafo_sobre_a_pior_dor_física_que_já_pude/hphmyhw/
apply,aplicar,desabafos,hpiunen,1640150911,2021,1,"A cirurgia se chama simpatectomia e é recomendada somente em último caso por ser invasiva e pode causar transpiração compensatória.

Fora ela há também a opção de aplicar botox, porém tem efeito temporário",/r/desabafos/comments/rltf6v/deleted_by_user/hpiunen/
apply,aplicar,desabafos,hpjhxa4,1640168391,2021,1,"E qual o efeito dela?
Da pra aplicar em casa?",/r/desabafos/comments/rlmdpl/update_primo_que_tomou_20_comprimidos_de_rivotril/hpjhxa4/
apply,aplicar,desabafos,hpk0kxj,1640181051,2021,3,"Aproveita e estuda programação no processo, vai treinando. Cria uns projetinhos e vai fazendo, se ver alguma coisa que pode aplicar a alguma tarefa. Busque aprender, aproveita que é de boas.",/r/desabafos/comments/rm3r13/tédio_no_estagio/hpk0kxj/
apply,aplicar,desabafos,hpmm499,1640220904,2021,6,"Cara... eu fiquei em um complexo penitenciario que era dominado por facções... e uma parada que muita gente não sabe (ou talvez não tem conhecimento) é que o PCC é meio homofóbico, digo... no próprio recrutamento (que chamamos de batismo) eles perguntam se você se relaciona com homens ou se você já se relacionou com algum detento... 

Claro que são casos e casos tipo... há membros muito proeminentes da facção que eram gays e tals mas a gestão vai mudando com o passar do tempo e o salve vem sempre de cima então os ""soldados"" simplesmente só obedecem ordens da sintonia.

Sobre estupros e essa parada do sabonete... é complicado tipo por isso existe a triagem antes de vc chegar na muralha, primeiro para separarem vc pelo tipo de crime que você cometeu, se você é de facção e tem até alguns presidios hoje em dia que tem ""ala neutra"" (o que eu não recomendo... pq as facções dominantes sempre colocam infiltrados lá pra ver se tem traidores, facções inimigas, etc... esse foi um dos motivos que escolhi ir pra ala dominante da p2 de presidente venceslau)

Mas tem vezes que os proprios guardas sacaneiam os apenados principalmente os que cometeram crimes hediondos, estupros, (principalmente de vulneravel) mutilação de crianças, matar gravidas, essas paradas assim... padre pedofilo etc... os guardas mais antigos costumam deixar esse tipo de apenado 1 ou 2 dias na sala da facção dominante ou até mesmo na ala neutra... e entregam o cara gritando o artigo dele... ai se ele vai sair inteiro... depende muito, tipo, muito mesmo... pq estamos falando de um presidio de segurança máxima onde muita gente lá não tem oq perder, tão com penas de 100, 200, 300, 400, 500 anos nas costas... (claro que só vão cumprir até o máximo que a lei permite...) então o que é mais um homicidio?

&#x200B;

Mas uma parada que descobri depois que sai da cana foi o seguinte (isso é uma parada que muitos apenados não tem essa informação, se não repensariam muito bem suas atitudes...)  


Cada crime que eles cometem lá dentro da cadeia é um novo processo que é aberto... e o sistema faz com que esses processos só corram depois que a pena vigente acabe ou vc pague... por exemplo, vamos supor que você matou alguém e cumpriu sua pena por homicidio, mas no final da pena antes de sair fora faltando 1 ou 2 anos pra sair você mata um guarda ou faz alguma merda... ai além de você perder a progressão de regime q tava vindo vc vai ficar mais um monte de anos presos. 

Essa é a forma do brasil aplicar prisão perpetua (e os próprios presos muitas vezes nem percebem)",/r/desabafos/comments/rmi9ji/depois_que_sai_da_prisão_a_ansiedade_tá_me_matando/hpmm499/
apply,aplicar,desabafos,hpn4en3,1640229717,2021,2,"Pelo meu entendimento esse seria um relacionamento de benefício mútuo, ele receberie uma vida melhor e ela receberia um ""novinho"".

Seria hipocrisia se ele tentasse aplicar o golpe do green card.",/r/desabafos/comments/rmd6sc/não_aguento_mais_esse_bostil/hpn4en3/
apply,aplicar,desabafos,hpqujxz,1640303483,2021,1,"Eu aprendi sobre taoísmo com a sua idade, implantei na minha vida por um tempo e fui bem feliz, mas comecei a ter problemas tão grandes na minha vida que nunca mais consegui aplicar os princípios, infelizmente. Tô com 24 hoje em dia.",/r/desabafos/comments/rn8f3w/como_ficar_menos_frustrado_com_uma_derrota/hpqujxz/
apply,aplicar,desabafos,hpvl0mz,1640399935,2021,1,"Muito simples amigo, hoje existem investimentos que valem muito mais a pena. O rendimento da poupança é muito baixo, já não é o que nossos pais costumavam tirar na nossa infância. Hoje vc se não quiser mexer em ações, pode aplicar em fundos de ações, se não quiser aprender sobre renda fixa, aplica em fundos de renda fixa e assim vai. Até as próprias crypto moedas , por mais arriscado que é, se colocar um dinheiro que não lhe fará falta, gera um resultado as vezes que te surpreende. Acho que vc pode deixar o preconceito um pouco de lado e tentar não alimentar os bancos com o seu suor. Mas se está feliz assim quem somos nós pra discordar",/r/desabafos/comments/rnoxlm/se_recebessem_um_salário_de_28000_reais_por_mês_o/hpvl0mz/
apply,aplicar,desabafos,hq0n4x6,1640519895,2021,2,"Gosto da sua dica e é ótima pra quem pode estar pensando em como começar depois do colégio e tudo mais.

Eu acabei fazendo o que fiz mais por ncessidade e vontade de adiantar minhas conquistas pra resolver outros problemas, como econômicos e afins. Mas esse é o certo a se fazer. Inclusive conheci recentemente uma coisa chamada pomodoro technique que é mais ou menos isso daí, que vou tentar aplicar pra meus estudos pra concurso.",/r/desabafos/comments/roupn3/bloqueio_criativo_de_férias/hq0n4x6/
apply,aplicar,desabafos,hq1doui,1640535829,2021,2,"
Cara pode parecer coisa de coach, mas leia o livro Como Fazer Amigos e Influenciar Pessoas do Dale Carnegie. Leitura bem simples e fluida que mostra técnicas bem simples e inspira muito. Li e reli e sempre tento aplicar os conceitos na minha vida profissional e pessoal, está me  ajudando muito. E continue na terapia, tudo fica mais fácil quando a gente tem um profissional indicando o caminho.",/r/desabafos/comments/roy3aq/o_que_eu_tô_fazendo_errado/hq1doui/
apply,aplicar,desabafos,hq5c0cb,1640614336,2021,2,"Eu consegui identificar o mesmo erro em todas as tentativas citadas no seu post, falta aplicar o que foi estudado, vou te dar o meu exemplo.

Eu jogo muito RPG e quando eu não sabia inglês eu sofria muito, então comecei a estudar sozinho. Eu estudava o tanto de horas que dava vontade por dia e logo em seguida ia jogar pra tentar usar o que eu aprendi naquele período e assim fui fixado as coisas bem rápidas na minha cabeça. 

Recomendaria fazer o mesmo que eu fiz, hoje eu me viro tranquilamente em qualquer lugar onde eu preciso usar inglês, principalmente no estágio quando preciso conversar com alguém de fora.",/r/desabafos/comments/rpkiuu/me_sinto_inútil_por_não_saber_inglês/hq5c0cb/
apply,aplicar,desabafos,hqdbold,1640751215,2021,2,">🥺

Então corra atrás, leia as dicas do pessoal e tente aplicar, provavelmente ainda haverão janelas para você ue para mim jamais haverão pois deixei passar.",/r/desabafos/comments/rnhso5/sou_um_bv_velho_e_me_sinto_muito_mal/hqdbold/
apply,aplicar,desabafos,hqdceve,1640751584,2021,2,"Agradeço muito á todos que comentaram e dedicaram seus tempos a me ajudar nisso, nunca imaginei que teria tantas interações.

Eu posso ser chato as vezes pois isso realmente me machuca, mas que isso não os impeçam de comentar e falar oque tiver que ser dito, até pq um dos objetivos desse post é ajudar pessoas mais novas que eu, e que ainda podem aplicar conselhos sobre escola/faculdade, situações que eu de maneira idiota deixei passar, e que portanto deixou minha situação praticamente irreversível.",/r/desabafos/comments/rnhso5/sou_um_bv_velho_e_me_sinto_muito_mal/hqdceve/
apply,aplicar,desabafos,hqddn5l,1640752215,2021,6,"Alguns hábitos de fato fazem bem e outros não, banho gelado e leitura são ótimos para o dia a dia, nofap é apenas recomendado para aqueles que são extremamente viciados em pornografia em nível que esteja afetando o psicológico do indivíduo, jejum de dopamina nunca ouvi falar, pesquisando e formulando uma opinião ao meu ver seria interessante fazer essa prática por apenas um dia caso você seja totalmente dependente dessas atividades, entrar em uma comunidade redpill seria a total piada de tudo o que você citou, essa realmente não faz o menor sentido.   


Enfim, dá para aplicar algumas coisinhas e ter um efeito positivo, mas tem que ser feito gradualmente e não bruscamente como tudo na vida se não acontece justamente o efeito contrário que você relatou.",/r/desabafos/comments/rqvhbl/segui_essas_dicas_de_gurus_de_autoajuda_quase/hqddn5l/
apply,aplicar,desabafos,hqeserp,1640786746,2021,2,"Alexandre é bom pra rotina de estudos e como motivacional, mas técnica de estudo mesmo pra se aplicar e que seja eficaz tem que ver o da Laura amorim, o conteúdo dela é mais focado nisso, da uma olhada depois, mudou totalmente minha forma de estudar. Da pra achar o PDF do livro online ou no site do rateio ninja, a didática do livro tbm é bem direta e sem termos difíceis.

No momento pra indicar só o dela mesmo, vi o do Alexandre muito tempo atrás qnd eu nem era concurseiro ainda rsrs e outros que não gostei MT e enrolavam",/r/desabafos/comments/rqeegj/eu_sou_um_perdedor/hqeserp/
apply,aplicar,desabafos,hqgs0k9,1640815453,2021,1,"Rapaz, eu estava hoje mesmo vendo um vídeo do Monge Genshô sobre essa transferência karmica de pai para filho. Mas é só você ser menos fatalista e tentar sempre examinar se as consequências que você está sofrendo não têm como causa os seus próprios atos. Faz só esse exercício de autorreaponsabilização para promover os ajustes necessários em ti e segue o baile sem ficar aficcionado pela coisa do karma. Eu dou o maior valor aos vídeos do Monge Genshô, mas não tem quem me faça ficar sentada em zazen, isso meio que beira a loucura e eu tenho mais o que fazer. Porém, dá pra encaixar aqui e acolá a filosofia da coisa. É só não ficar bitolado e pegar só o que importa para aplicar na vida prática. O fato de eu simpatizar com o zen budismo e ver lógica nessa coisa do karma não vai fazer com que eu espere que isso tenho um caráter fixo e científico. Pera lá! Mas pega a ideia e dá uma ajustada. A minha religião são meus próprios princípios éticos. Não ignorar o que é, tentar me libertar da ignorância, raiva e sentimentos menores. Mas a gente vive em sociedade. Viver como humanos, não como santos, é equilibrar os pratos das nossas conquistas, produtos do ego, inexoravelmente. Para que mantenhamos nítido o retrato social daquilo que reputamos sucesso, é preciso ceder, resignar-se, esforçar-se para que os pratos não caiam e se quebrem. Um ou outro prato quebrará em algum momento, mas isso faz parte da vida de quem exerce um papel social e esforça-se para sustentá-lo.",/r/desabafos/comments/rrbnxv/pessoas_do_passado_se_uniram_pra_me_destruir_sem/hqgs0k9/
apply,aplicar,desabafos,hqhtak0,1640831290,2021,2,"Cara, infelizmente a gente tem que jogar o jogo. O que quero dizer com isso é que vc tem que ver as brechas de oportunidade. Iguais a vc tem mais dezenas, centenas, milhares e milhões de pessoas no Brasil. Várias delas não conseguem o emprego, algumas conseguem. O que essas que conseguem tem diferente? Vc achou que seria selecionado em várias vagas? Talvez sua expectativa está fora da realidade. A realidade é que vc vai ser rejeitado na maioria das vagas que tentar. A maioria esmagadora das pessoas vão ser rejeitadas.

Se eu fosse vc, focaria somente em vagas que são da sua área ou próximas que vc tem vontade de trabalhar, por dois motivos: primeiro que vc vai tentar menos vagas e com menos processos rodando simultaneamente vc consegue se dedicar melhor a cada um deles e segundo que vc vai conseguir aplicar melhor seus conhecimentos voltados a sua área de estudo.

Pare de tentar vagas que são muito abaixo do que vc está se formando para estudar. Se coloque na cabeça de um dono, gestor de empresa ou mero coordenador: pq ele iria contratar vc pra ser empacotador  ou assistente de DP se vc cursa eng. e daqui a pouco tá saindo da empresa pra uma oportunidade na sua area? É assim que o pessoal pensa, eles querem alguém pra trabalhar lá até morrer. Então não vale a pena vc perder seu tempo nisso.

Por fim, não se mate. Não vou te dizer que a vida vale a pena, pq pra algumas pessoas não vale mesmo, mas o capitalismo não vale a sua vida. Ele já rouba a vida de milhões de pessoas durante várias décadas, a sua não precisa ser mais uma. Tente pelo menos algo diferente antes disso. Vou estar aqui torcendo por vc.",/r/desabafos/comments/rrh8rp/já_não_aguento_mais/hqhtak0/
apply,aplicar,desabafos,hqlg55b,1640898395,2021,1,"Entendi, mas pra eu aplicar isso teria que formatar ou como que é...?",/r/desabafos/comments/rs7onu/meu_pc_de_repente_começou_a_demorar_mais_pra/hqlg55b/
apply,candidatar,desabafos,hb9evy8,1630545854,2021,1," simples, pirateia uns cursos na Net, aprende os assuntos que cê curte, bota no currículo e atira pra todo lado. Haverão vagas q tu vai precisar fazer teste de português e raciocínio lógico online, não hesite em usar o Google. 

e tbm se tiver menos de 1 ano de curso pela frente, desiste dos estágios e foca em vaga de trainee. Passei por isso esses últimos meses e foi assim q consegui um emprego como trainee.

oq me ajudou a achar vagas tbm foi pesquisar no Google ao invés de uma plataforma própria pra vagas, pq no Google junta tudo aí facilita pra se candidatar.",/r/desabafos/comments/pfu72m/faço_tecnólogo_em_ti_mas_tá_foda_arrumar_estágio/hb9evy8/
apply,candidatar,desabafos,hd5va4q,1631847590,2021,2,">Pois é devia ter deixado quieto, agora tô fudido, nem vou mais me candidatar à vagas de emprego. E o pior é que ei tinha vários planos pro futuro e ficar sem trabalho vai melar tudo...

Pera, nem aconteceu nada e vc ta com essa neura toda pq leu uns relatos na internet? 

Sai dessa mano, as coisas não são assim não. Se quem moveu ação trabalhista não encontrasse mais emprego ninguém ia trabalhar mais. 

Só pra vc ter noção, em 2018 foram iniciados aproximadamente 2,5 milhões de processos trabalhistas, e já tinha 4,8 milhões de processos pendentes. 

Imagina agora com a pandemia e cheio de gente sendo mandada embora sem receber tudo certo...",/r/desabafos/comments/pppto0/entrei_com_uma_ação_contra_empresa_e_vou_me_fuder/hd5va4q/
apply,candidatar,desabafos,heerhb4,1632699348,2021,5,"Tem que se candidatar no site. Se teu perfil interessar, vão te chamar pras demais etapas de algum processo seletivo que for acontecer.

Geralmente tem uma prova objetiva, várias questões de matemática e lógica. Depois tem entrevista, dinâmicas de grupos... É um processo longo, às vezes dura uns 2 ou 3 meses até te chamarem pra entrevista com o gerente (normalmente é a última etapa, quase que apenas uma formalidade)",/r/desabafos/comments/pw0tk1/prova_do_banco_do_brasil/heerhb4/
apply,candidatar,desabafos,heibxyq,1632772420,2021,3,"""Achamos uma vaga de tal tal tal pra vc""

Ai vc entra no site e tem q pagar pra poder se candidatar na vaga kkkkk",/r/desabafos/comments/pwm2u3/infojobs_não_é_real/heibxyq/
