termo,query,subreddit,id,created_utc,ano,score,body,permalink
apply,aplicaram,BrasildoB,hc7v2g1,1631215637,2021,2,"Eu diria que é parcialmente verdade.

Não é de hoje que o STF, o Guardião da Constituição, vem agindo de forma... Não condizente com sua função, por assim dizer.

Um exemplo bem famoso já é toda a volta que deram na presunção de inocência. Conforme a Constituição Federal estabelece, em clausula pétrea (leia-se: imutável):

>“Art. 5.  Todos são iguais perante a lei, sem distinção de qualquer natureza, garantindo-se aos brasileiros e aos estrangeiros residentes no Pais a inviolabilidade do direito à vida, à liberdade, à igualdade, à segurança e à propriedade, nos termos seguintes.(EC nº 45/2004)  
  
LVII- ninguém será culpado até o trânsito em julgado de sentença penal condenatória”;

Por conta deste dispositivo, que como o próprio Moraes já disse outrora, é um principio basilar do Estado de Direito, é vedada a prisão antes do trânsito em julgado, isto é, antes do fim definitivo do processo, esgotando-se todas as medidas possíveis para reverter a decisão que condenou o réu.

O STF relativizou isso em um julgamento, cerca de um ano antes da prisão do Lula, e manteve esse entendimento até novembro de 2019, depois que o Lula já tinha sido mantido preso conforme o entendimento de que seria possível a prisão na segunda instância em alguns casos, como no dele.

No fim, votaram contra algo que, ao meu ver, soou mais como uma grande jogada política do que como uma discussão de matéria constitucional bem dirigida, ajudando o país a entrar no caos atual.

Também ficaram em silêncio no momento do impeachment da Dilma, onde o Senado rasgou a constituição para favorecer ela:

>  Art. 52. Compete privativamente ao Senado Federal:  
>  
>I - processar e julgar o Presidente e o Vice-Presidente da República nos crimes de responsabilidade, bem como os Ministros de Estado e os Comandantes da Marinha, do Exército e da Aeronáutica nos crimes da mesma natureza conexos com aqueles;       
>  
>Parágrafo único. Nos casos previstos nos incisos I e II, funcionará como Presidente o do Supremo Tribunal Federal, limitando-se a condenação, que somente será proferida por dois terços dos votos do Senado Federal, **à perda do cargo, com inabilitação, por oito anos, para o exercício de função pública,** sem prejuízo das demais sanções judiciais cabíveis.

Ou seja, não aplicaram a consequência jurídica cabível e necessária.

O STF, como órgão guardião da CF, sequer soltou uma nota de repúdio, até onde sei.

&#x200B;

Mais recentemente, tem havido algumas ações que, ao meu ver - e ao de outros juristas - configuram crimes de responsabilidade. Um exemplo é a prisão ilegal do Daniel Silveira, que embora compita com o Bolsonaro pra ver quem consegue falar mais discursos ilegais por segundo, não encontra amparo legal na forma como foi feita. Aí eu basicamente teria que entrar em uma explicação sobre tipos de flagrante e crime continuado vs crime permanente, o que me sentirei feliz em fazer caso assim deseje, mas para resumir, basta dizer que a prisão desobedece a lei tanto quanto os irracionais e abomináveis atos do deputado que foi preso.

&#x200B;

Concluindo: o STF tem sido uma grande barreira pro Bolsonaro não reinar livremente, cumprindo seu papel no sistema de freios e contrapesos da Tripartição de Poderes, graças aos deuses. Porém, ainda que em uma escala quase que microscópica se comparado a 90% de qualquer agente do Executivo ou do Congresso, ele tem, de fato, rasgado a constituição em momentos que vejo como críticos. 

&#x200B;

Fonte: sou bacharel em direito, desiludido com nossa realidade democrática e jurídica. Haha!",/r/BrasildoB/comments/pkhcre/o_stf_está_rasgando_a_constituição/hc7v2g1/
apply,aplicou,BrasildoB,hdpzyci,1632234673,2021,5,"[Tem esse texto do próprio CEPS-BR](https://cepsongunbr.com/2021/07/05/o-que-e-a-ideia-juche-breves-consideracoes/). Obvio que eles usam exclusivamente fontes do estado da RPDC, então é bom sempre levar isso em mente, mas já é um passo a frente comparado com alguma CNN da vida.

Tb vale a pena ler sobre o que é o Sadae/Sadaejuui. Basicamente, é uma aplicação geopolítica de partes do confucionismo que conclui que países pequenos e fracos (como a Coreia) devem se apoiar em grandes potencias de uma forma meio paternal. O Juche quebra justamente com isso quando exige (pelo menos na teoria) a independencia total do país. A coreia do sul aplicou um Sadae modernizado com os EUA, e a do norte inventou o Juche.

Tem um livro chamado ""A revolução Coreana e o desconhecido socialismo Zuche"" que eu ouvi mta gente falando bem, mas eu nunca li. Fica a minha recomendação indireta (?)",/r/BrasildoB/comments/ps3twv/worldbuilding_e_se_de_repente_tivesse_um_partido/hdpzyci/
apply,aplicar,BrasildoB,hc685h6,1631189619,2021,4,"Vou te aplicar numa interessante hoje então: o ICMS é um imposto cobrado ""por dentro"", o que significa que a alíquota do próprio imposto é embutida na base de cálculo dele mesmo. Ou seja, ao cobrar uma alíquota de 18% como a de MG sobre um produto de 100r$, vc cobra o ICMS sobre (100r$ + valor do imposto). Dá uma equação de segundo grau e na prática a alíquota é por volta dos 23% pra maioria das operações...



Isso é uma *aberração* matemática, fiscal e tributária e ninguém nunca conseguiu me explicar o sentido ou a origem. Eu acho que só existe pra distorcer e confundir a realidade, por que uma pessoa comum não vai saber nem fazer a matemática pra conseguir descobrir quanto tá realmente pagando... Fora que possivelmente é inconstitucional, já que a lei proíbe dupla tributação, mas a gente vê a torto e a direito...



E ainda tem mais treta quando uma pessoa jurídica vende pra outro estado, pq tem q fazer conta de quem fica com qual parte do ICMS, aí a matemática fica cabulosa mesmo... E isso só ICMS né, tem também PIS, COFINS, II, ISS, IPI, IRPF, CSLL, ARFMM...",/r/BrasildoB/comments/pkvjoc/eu_estava_lendo_o_que_é_icms_hoje_de_manhã/hc685h6/
apply,aplicar,BrasildoB,he6kvsp,1632543747,2021,-5,"Olha como funciona. Agora é só pedir para aplicar aos agentes estatais prevaricadores, para deixarem de ser inimputáveis",/r/BrasildoB/comments/puwklz/alexandre_garcia_é_demitido_da_cnn_após_defender/he6kvsp/
apply,aplicar,BrasildoB,hevjpyl,1633023907,2021,5,Acho que os dois tão certos. Ela como filhote do Lemman tá aqui pra aplicar agenda liberal.,/r/BrasildoB/comments/pyax24/tábata_foi_em_live_com_vereadora_do_novo_em_vez/hevjpyl/
apply,aplicar,BrasildoB,hf6aw1d,1633227013,2021,0,"Entendo sua preocupação e ele reflete sobre isso no livro.

Seu plano passa por duas coisas essenciais para industrializar o país: taxas de juros baixas(nada fazem contra a inflação) e a criação de uma burguesia industrial parecida com a que foi criada na revolução das garagens dos EUA 

É complicado combater o rentismo, mas o trabalhismo precisa continuar fazendo isso. Pautando seu projeto cedo e incluindo o povo na política ( plebicitos e e-government) ele espera conseguir pressão para fazer suas medidas andarem. Também, com a renegociação das dividas espera apoio dos partidos.

A classe trabalhadora precisaria se adaptar. obviamente se você quer expandir as indústrias, precisa de gente que desenvolva tecnologia de ponta( a indústria q mais importa para o pontapé inicial) e que migre para o segundo setor. Isso é feito através do sistema S de ensino para capacitar os intermediários e colocar os doutores que estão perdidos por aí nelas e estabelecer relações com as universidades (para formar a burguesia industrial tecnológica e possibilitar a tecnologia de ponta).

Indústria não é mais um monte de gente apertando parafuso. Temos universidades, precisamos agora aplicar o conhecimento, favorecer a criação ou desenvolvimento de indústrias de ponta com medidas de governo e incluir o povo no governo para garantir apoio popular.

Isso pode não dar certo, mas confio na equipe econômica do Ciro bastante. Andre Lara Resende, Nelson Marconi são alguns nomes de peso dela.",/r/BrasildoB/comments/q00w42/como_ele_achou_que_alguém_iria_engolir_esse/hf6aw1d/
apply,aplicar,BrasildoB,hfhmqft,1633447934,2021,2,"Analisando o caso brasileiro eu cheguei na seguinte possibilidade: pode ser cortina de fumaça para encobrir as denúncias de discurso de ódio do facebook e do Pandora Papers, pois as duas denúncias se relacionam, pois se tratam das mesmas pessoas. Tanto empresários quanto cargos administrativos do alto escalão do bolsonarismo que ganharam mais poder com o discurso de ódio propagado pelo Facebook e whatsapp, foram denunciados pelo Pandora Papers. Se não houvesse a queda das redes ontem, os noticiários não poderiam desfocar do Pandora Papers e com uma pressão pública maior, tais contas seriam escancaradas, podendo revelar transações entre Facebook/Whatsapp e o bolsonarismo. O mesmo pode se aplicar facilmente em outros países. Foi uma denuncia global, envolvendo muitos poderosos, assim como a queda das redes do Zukeberg foi global. Infelizmente esses caras são tão poderosos que as duas denúncias podem acabar em pizza e essa nossa especulação pode não passar de teoria da conspiração sem mais provas fundamentadas",/r/BrasildoB/comments/q1wd4p/teoria_da_conspiração_bug_do_facebook_foi_cortina/hfhmqft/
apply,aplicar,BrasildoB,hgfjzhy,1634089758,2021,1,"É nojento porque as regras não irão se aplicar a eles. Mas no fim é só parar de destruir o nosso próprio meio ambiente que não sofreremos essas sansões. Ao menos neste caso pelo que parece não são sansões para tentar parar o desenvolvimento do Brasil.

Sinceramente, não vejo o Brasil se desenvolvendo através do agronegócio, muito pelo contrário na verdade.",/r/BrasildoB/comments/q6vypj/hipocrisia_americana_eua_querem_lei_florestal/hgfjzhy/
apply,aplicar,BrasildoB,hhndd11,1634925938,2021,17,"A logica de Propriedade pessoal x Propriedade privada pode se aplicar muito bem a essa questão:

A musica que o artista independente faz, a ilustração que o ilustrador independente faz, é propriedade pessoal. Foi criação daquela pessoa.

O direito autoral de imagem do Mickey Mouse, atualmente detido por um conglomerado sem face, é propriedade privada e não deveria existir. O direito deveria ser do Walt Disney, a pessoa física, e ele poderia ter direito de ceder esse personagem exclusivamente para a empresa dele, mas depois de poucos anos, ou no máximo até o momento que ele faleceu, o Mickey e todos os personagens e histórias criados por ele deveriam ter imediatamente entrado para o domínio público.

As leis originais de copyright eram parecidas com o que eu descrevi, até sofrerem lobby pesado por empresas midiáticas, com protagonismo especial por parte da própria Disney.",/r/BrasildoB/comments/qdkpqp/propriedade_intelectual_é_uma_ilusão/hhndd11/
apply,aplicar,BrasildoB,hilge5i,1635561051,2021,2,"Posso estar falando merda e, se estiver, por favor me corrijam, mas o maoísmo não seria pensado especificamente para a China em uma época específica? Não sei se faria muito sentido aplicar o maoísmo no Brasil no século 21.",/r/BrasildoB/comments/qi1iif/qual_a_sua_visão_sobre_um_governo_maoísta_no/hilge5i/
apply,aplicar,BrasildoB,hin3ulq,1635601082,2021,1,"A liberdade de expressão absoluta é mais fácil de entender e aplicar em uma sociedade, não?

A censura, mesmo que seja a ""sensata"", é manipulada por grupos políticos.

Oq faz mais mal pra sociedade? Um discurso como o nazismo circulando solto, ou o risco do que é ""sensato"" nas mãos de um grupo político organizado?

Eu fico um pouco dividido nesse assunto. Sinto que proibir de falar de nazismo é melhor pra sociedade, mas ao mesmo tempo, isso pode ser usado como prerrogativa para censurar comunismo, por exemplo. Afinal, as pessoas mudam, as visões mudam.",/r/BrasildoB/comments/qikgd3/deleted_by_user/hin3ulq/
apply,aplicar,BrasildoB,hka8tj7,1636684868,2021,2,"Vou atrás desse Paul. Falo do Podolinsky mas nunca o li diretamente, mas existem várias revisões nas obras de um 'Marxismo econômico ecológico' e da economia ecológica em geral. Se eu fosse recomendar alguém nessa área, diria para ver o Joan Martinez Alier, que leva os desenvolvimentos teóricos da economia ecológica para suas implicações anticapitalistas.

>É uma raridade que pra mim se origina da missão histórica-concreta do Marxismo de destruir teoricamente e desorganizar politicamente movimentos como o malthusianismo e o darwinismo social. Por mais nobre que isso seja, ao longo do tempo vira um preconceito científico que o mainstream não tem problemas.

Não sei se entendi essa parte, a raridade nesse caso é trabalhar nessa fronteira entre economia-ecologia? E isso viraria o preconceito cientifico em questão? Vou aguardar sua resposta. Mas vou só comentar que pelo que me lembro o tipo de pesquisa que podolinsky fez foi bastante rejeitado na base de que tinha conotações malthusianas, o que é bastante complicado, não dá para ficar na ideia de que qualquer sistema que reconheça a finitude dos recurso e o fator demográfico termina em malthusianismo, esse é acima de tudo uma forma incorreta de dimensionar o demográfico dentro de uma variedade de fatores, e que se move num sentimento reacionário antes de tudo. Até porque um  *neomalthusianismo* atravessou as correntes políticas da classe trabalhadora, que colocaram o planejamento familiar e o uso de contraceptivos como parte de um projeto emancipatório do proletariado, das mulheres e da sexualidade - é um péssimo nome para se aplicar à uma interpretação tão diferente, mas enfim, Joan Martinez Alier discute isso também.

Nossa mas eu adoro discutir com você também. Não sei tanto se a gente discorda tanto, as vezes pode ser só uma diferença na descrição das coisas. As afinidades a gente encontra no agir né, e mesmo não tendo agido eu vejo muito valor nas posições heterodoxas que você toma, principalmente pq você parece ser o tipo de heterodoxo que sabe circular entre os ambientes, sabe *falar marxismo-leninismo* e mesmo assim dizer coisas novas e de valor, eu acho isso extremamente divertido e aliás me dedico como posso de vez em quando à aprender isso, e dar mais nuancias à minha visão de mundo, o que todo mundo diz que eu não tenho aqui nesse sub hauhuhsauhs. Mas eu supunha que você estava no mínimo numa transição de perspectivas políticas rs eu acho o maoismo meio fascinante, não do jeito que os maoistas acham, mas penso isso observando o percurso antagônico que tomou, e toma hoje em dia, dentro do leninismo, e o quão paradoxais são alguns eventos da china maoistas. Enfim, devo estar sendo confuso, mas é o tipo de coisa que comecei a pensar depois de começar a ler sobre a New Left Chinesa.

Enfim, boa noite!",/r/BrasildoB/comments/qq7u97/ethiopia_descending_into_widening_civil_war_un/hka8tj7/
apply,aplicar,BrasildoB,hkhmr2e,1636830909,2021,2,"Estive estudando capital financeiro esses dias.

É um fato observável e que foi incorporado em qualquer teoria econômica que em crises os juros tendem a crescer. Podemos retratar isso como excesso de demanda em relação a oferta pelo nível elevado de entesouramento (guardar dinheiro pra investir na estabilização). Podemos retratar isso como uma disputa de poder entre capital financeiro e industrial pelo excedente cada vez menor. As duas visões são verdadeiras.

O que eu quero sugerir aqui é pensar essa abstração dentro do contexto da economia brasileira. Numa economia permanentemente fragilizada e onde todo investimento é visto como ""risco"", isso poderia explicar as taxas de remuneração absurdas cobradas pelo investimento e consequentemente a hegemonia política do capital financeiro. Não é algo que possa se aplicar mecanicamente pois vemos que no crescimento o capital financeiro se fortaleceu em vez de sair de cena, mas é algo pra se considerar quando mesmo o crescimento vem de bases frágeis; insustentáveis e vulneráveis às oscilações internações.

A maioria dos trabalhos históricos sobre hegemonia do capital financeiro fala sobre a ""ciranda financeira"" na ditadura militar, que entendo como dívida pública com taxas de ganho cada vez mais voláteis e absurdas pra garantir investimento num contexto de inflação. Num contexto diferente foi isso que aconteceu também no governo FHC: o aumento das taxas de juros para atrair capital estrangeiro e valorizar a moeda. Tudo isso faz mais sentido quando se leva em consideração o subdesenvolvimento.      

A ""financeirização"" do Brasil coincidiu com a crise do capital industrial. Se esse processo aprofundou a crise do capital industrial, em última instância ele foi consequência e não causa.",/r/BrasildoB/comments/qsy5lz/batepapo_livre_semanal_131121/hkhmr2e/
apply,aplicar,BrasildoB,hkv4jn9,1637077371,2021,2,"Claro que liga... liga tanto, que além de tentar se justificar nesse último comentário, tentou aplicar aquela velha falácia quando entrou em desespero , característica de todo desonesto que resolve ruminar em tom de proselitismo, toda sorte de senso comum possível. Bem típico, até essa sua última tentativa de responder que não liga...😂",/r/BrasildoB/comments/quiymn/drag_queen_e_ativista_das_causas_lgbt_é/hkv4jn9/
apply,aplicar,BrasildoB,hl5sr6t,1637265002,2021,0,Pq a gente não espera ficar rico pra só dps aplicar essas medidas aí?,/r/BrasildoB/comments/qws5ta/o_que_acham_da_afirmação_ultraliberal_de_que_a/hl5sr6t/
apply,aplicar,BrasildoB,hlfe2rs,1637440848,2021,2,">Claro, pra MMT isso não é um problema e o dinheiro traz a economia à vida espontaneamente como um demiurgo

MMT não diz nada disso. Diz apenas que o limite pra expansão monetária é um limite real.

Se um país não produz petróleo ele não pode emitir moeda local e se abastecer de petróleo por exemplo. Ele precisa obter moeda conversível e manter estoque de reservas internacionais. Pra isso ele precisa replanejar e adequar a base produtiva local, que foi basicamente o que a China fez durante a guerra fria. 

O problema de se aplicar esse princípio é um problema geopolítico. Existe uma divisão internacional do trabalho que favorece o norte global, que obviamente não vai querer largar o osso. E especificamente no Brasil existe também uma elite econômica tosca, burra e subserviente que internamente se beneficia do nosso papel de pais exportador de commodities.",/r/BrasildoB/comments/qy52us/projeto_de_glauber_braga_de_caráter_mmt_para/hlfe2rs/
apply,aplicar,BrasildoB,hnumv4r,1639057513,2021,-10,"Área de T.I esta ótima do jeito atual, muita vaga sobrando e tem muita oportunidade boa. 

Galera pode vir zoar de farialimer e bla bla bla mas é  a verdade, só não ta ganhando bem em t.i quem não quer.

Basta procurar que tem vagas tanto 100% home office quanto presenciais. 

O que eu vejo muito no mercado é gente que não tem coragem de sair do trabalho atual ou só fez o curso pela ""moda"". 

No meu trabalho mesmo o rapaz do suporte técnico tem mestrado dentro da área mas não sabe aplicar o conhecimento e nem mostra vontade de querer mudar de setor.

Atualmente um sindicato iria mais atrapalhar do que ajudar.",/r/BrasildoB/comments/rcgoh5/sindicatos_de_ti_no_brasil/hnumv4r/
apply,aplicar,BrasildoB,ho82e2p,1639295369,2021,9,"Pode não ser ele de verdade, mas isso aconteceu IRL. 

Falou que racismo não existia e depois foi chamado de macaco. Tentou desmoralizar uma Vereadora trans, e falar em congresso que era gay, e perdeu um monte de votos. Ou seja, o cara virou piada. Pq enquanto a direita vivia aplaudindo enquanto ele gerava quoeficiente eleitoral chega Ana cámara e tenta fazer o mesmo showzinho e aplicar o discurso que a direita aplaudia pq era conveniente acaba caindo por terra diante da realidade.


Gente como ele Sérgio Camargo e Hélio Negão não tem o mínimo de respeito próprio.",/r/BrasildoB/comments/re2fzc/fernando_holiday_do_mbl_postando_no_4chan_sobre/ho82e2p/
apply,aplicar,BrasildoB,hojjp7a,1639507135,2021,0,"A palavra presidentE já é ""neutra"", da mesma forma que intendente, concorrente, depoente, doente, vidente, tenente, entre muitas outras.

Nada contra a Dilma ou a luta contra o machismo e tal. Mas por acaso a palavra ""presidente"" não é um bom exemplo pra aplicar esse tipo de coisa, pois ela já é ""neutra"" e portanto não faz sentido falar ""presidenta"".",/r/BrasildoB/comments/rg63zg/quando_se_fala_de_linguagem_neutra_não_é_de/hojjp7a/
apply,aplicar,BrasildoB,hpplgrv,1640283666,2021,1,"Eu não assisti muita coisa, mas o socialista parece que jantou o outro.  

É muito difícil debater pois o resultado da China é inquestionável.   

O debate teria de ser outro, como aplicar algo assim em todos os lugares.",/r/BrasildoB/comments/rmsdfb/debate_sobre_a_china_e_gastos_públicos_entre/hpplgrv/
apply,aplicar,BrasildoB,hpud7rp,1640376028,2021,1,"Você quer dizer que você vê o movimento evangélico como uma ameaça ao nível de fascistas, neo nazistas e golpistas? Se for isso boa sorte em governar o país com quem quer que seja eleito porque esse povo não vai embora, pelo contrário, eles estão aumentando cada dia, devem passar os católicos como maior grupo religioso do país na próxima década e com isso a participação dos evangélicos só vai aumentar mais e mais daqui pra frente, goste você disso ou não. Ainda acha que criar uma política de estado anti-evangélica tem alguma chance de sucesso? 

A liberdade religiosa desde a CF88 não depende de chancela do Estado brasileiro pra existir, ela é absoluta até ao menos o momento em que essa religião defenda algo já criminalizado, isso é algo pacificado na legislação nacional e nesse ponto por mais que eu não goste de certos grupos evangélicos não tem nada que se possa fazer contra isso porque não se pode criminalizar fé ou ideologia. Quer criar a igreja da cientologia, jedi ou a religião do espaguete voador no Brasil? Esteja a vontade, a CF88 te garante proteção até pra vc montar a igreja do Maradona se você quiser e colocar ela, legalmente falando, ao lado da igreja católica e todas as evangélicas hoje em atuação e tem todos os direitos que elas tem hoje. 

Sobre o conceito de ""igrejas sérias"", quem dá a classificação de ""igrejas sérias"" ou ""igrejas não sérias"" nunca será o estado. Se você não se convenceu disso sugiro a leitura da sentença do STF que acabou com a obrigatoriedade do diploma de jornalista para ser jornalista no Brasil, vão aplicar exatamente a mesma lógica em uma eventual necessidade de se ter diploma pra ser pastor. Nunca iremos ter uma ""Ordem dos Pastores Evangélicos do Brasil"" com prova de conhecimento e/ou obrigação de diploma em teologia pra se registrar como pastor pra subir no púlpito da igreja. Quem tentar fazer qualquer coisa desse tipo será automaticamente taxado de ""cristofóbico"" e será severamente e pesadamente perseguido por toda a comunidade evangélica no Brasil (e te garanto que eles não vão expressar isso só através do voto em mais e mais pastores pro congresso), e dinheiro pra bancar essa turma não vai faltar pode ter certeza.

De novo, a esquerda ""progressista"" não entende o fenômeno evangélico no Brasil e pra ser honesto nunca nem fez questão de entender pra falar a verdade. Adotar como política de atuação o ""vamos antagonizar os evangélicos e silenciar eles politicamente porque são defensores de valores que nós não aceitamos"" vai ser um tiro de canhão no pé da esquerda no longo prazo porque vai abrir a porteira pra um monte de Bozos vindo por ai doidos pra transformar o Brasil em uma teocracia religiosa que faria o estado islâmico ficar corado de vergonha.",/r/BrasildoB/comments/rj4cyb/batepapo_livre_semanal_181221/hpud7rp/
apply,candidatar,BrasildoB,hc3ioie,1631130124,2021,10,"O governo Lula não foi perfeito e realmente não atendeu todas as pautas da esquerda, mas você vai mesmo deixar de votar no Lula pra dar vantagem a um candidato de direita que seria muito pior? Por que a gente não tem muitos candidatos de esquerda além do Lula, e com a força do Lula, pra se candidatar em 2022.  


E vamos lembrar que o Lula, apesar dos apesares, trouxe muitas conquistas pro nosso país, em especial ao povo pobre.",/r/BrasildoB/comments/pkblwb/tive_a_coragem_de_postar_isso_lá_no_rbrasil_pra/hc3ioie/
apply,candidatar,BrasildoB,hcrr7za,1631585751,2021,1,Existem chances dele ficar sem partido e não conseguir se candidatar?,/r/BrasildoB/comments/pnlnbc/em_processo_de_fusão_dem_e_psl_divulgam_nota/hcrr7za/
apply,candidatar,BrasildoB,hd95gpe,1631912373,2021,7,"Boulos vai se candidatar pra gov. O Glauber vai pra presidente, faltou ele",/r/BrasildoB/comments/pq6b86/em_quem_você_pretende_votar_pra_presidente/hd95gpe/
